product_id,item,category
2183,moody boy  door hanger,Home Decor
1255,filigris heart with butterfly,Home Decor
1655,heart decoration painted zinc,Party & Festive
960,"decoration hen on nest, hanging",Party & Festive
1683,hen house decoration,Party & Festive
2337,pack of 12 sticky bunnies,Party & Festive
2136,mini wooden happy birthday garland,Party & Festive
2581,pink happy birthday bunting,Party & Festive
437,blue happy birthday bunting,Party & Festive
3903,wood stamp set best wishes,Stationery & Craft
3905,wood stamp set happy birthday,Stationery & Craft
3906,wood stamp set thank you,Stationery & Craft
1453,glamorous  mug,Kitchen & Dining
896,cream wall planter heart shaped,"Health, Beauty & Personal Care"
1831,jumbo bag spaceboy design,Toys & Games
2802,red floral feltcraft shoulder bag,Apparel & Accessories
2566,pink floral feltcraft shoulder bag,Apparel & Accessories
129,airline bag vintage jet set red,Apparel & Accessories
128,airline bag vintage jet set brown,Apparel & Accessories
869,cosy slipper shoes large green,Apparel & Accessories
3857,white jewelled heart decoration,Party & Festive
1764,ivory hanging decoration  heart,Party & Festive
3507,stripey chocolate nesting boxes,Home Decor
787,christmas tree star decoration,Seasonal
782,christmas tree decoration with bell,Seasonal
739,chinese dragon paper lanterns,Stationery & Craft
2109,milk pan pink polkadot,Kitchen & Dining
510,boom box speaker boys,Home Decor
2557,pink fairy cake childrens apron,Toys & Games
3389,small pink magic christmas tree,Seasonal
2783,recycled pencil with rabbit eraser,Stationery & Craft
405,blue calculator ruler,Stationery & Craft
2801,red flock love heart photo frame,Home Decor
3037,scented candle in digitalis tin,"Health, Beauty & Personal Care"
1583,grow your own flowers set of 3,Garden & Outdoor
2809,red heart shape love bucket,Home Decor
3749,vintage post office cabinet,Stationery & Craft
3179,set of 6 3d kit cards for kids,Toys & Games
829,clear milkshake glass,Kitchen & Dining
2790,red baby bunting,Party & Festive
325,birds mobile vintage design,Stationery & Craft
3925,woodland  height chart stickers,Party & Festive
999,dinosaur lunch box with cutlery,Toys & Games
2863,red spotty biscuit tin,Kitchen & Dining
676,charlie + lola biscuits tins,Home Decor
680,charlie and lola table tins,Home Decor
679,charlie and lola figures tins,Toys & Games
587,cake stand white two tier lace,Kitchen & Dining
464,blue polkadot bowl,Kitchen & Dining
2513,pink  polkadot cup,Kitchen & Dining
3341,skull and crossbones  garland,Party & Festive
2355,pack of 6 skull paper cups,Kitchen & Dining
2356,pack of 6 skull paper plates,Kitchen & Dining
2346,pack of 20 skull paper napkins,Kitchen & Dining
28,200 bendy skull straws,Party & Festive
3351,skulls party bag + sticker set,Party & Festive
3213,set of 9 black skull balloons,Party & Festive
3498,strawberry honeycomb  garland,Party & Festive
2617,pink polkadot bowl,Kitchen & Dining
3203,set of 6 t-lights wedding cake,Kitchen & Dining
2113,mini cake stand t-light holder,Kitchen & Dining
2983,round cake tin vintage green,Kitchen & Dining
382,"black tea,coffee,sugar jars",Kitchen & Dining
3279,shoe shine box,Apparel & Accessories
537,bread bin diner style mint,Kitchen & Dining
3676,vanilla incense 40 cones in tin,"Health, Beauty & Personal Care"
1936,lavender incense 40 cones in tin,"Health, Beauty & Personal Care"
852,columbian candle round,Home Decor
851,columbian candle rectangle,Home Decor
4011,zinc finish 15cm planter pots,Kitchen & Dining
3404,small square cut glass candlestick,Kitchen & Dining
3283,silk purse babushka blue,Apparel & Accessories
195,army camo bookcover tape,Stationery & Craft
644,carrot charlie+lola coaster set,Kitchen & Dining
2081,memo board cottage design,Stationery & Craft
734,childs garden spade blue,Toys & Games
2000,love heart napkin box,Kitchen & Dining
3350,skulls greeting card,Stationery & Craft
1614,hanging chick  yellow decoration,Party & Festive
3212,set of 72 skull paper  doilies,"Health, Beauty & Personal Care"
3143,set of 36 paisley flower doilies,"Health, Beauty & Personal Care"
3445,spaceboy gift wrap,Toys & Games
433,blue glass chunky charm bracelet,Kitchen & Dining
387,black+white necklace w tassel,Apparel & Accessories
146,amber chunky glass+bead necklace,Kitchen & Dining
2704,poppy's playhouse livingroom,Toys & Games
1448,gingham rose wrap,Stationery & Craft
11,12 pencils tall tube posy,Stationery & Craft
2,12 coloured party balloons,Party & Festive
2567,pink flower crochet food cover,Kitchen & Dining
1301,flower vine raffia food cover,Kitchen & Dining
1336,food/drink sponge stickers,Party & Festive
2587,pink heart shape photo frame,Apparel & Accessories
1978,lilac diamante pen in gift box,Stationery & Craft
3296,silver diamante pen in gift box,Stationery & Craft
441,blue juicy fruit photo frame,Home Decor
1550,green juicy fruit photo frame,Home Decor
1489,glitter butterfly clips,Home Decor
218,assorted creepy crawlies,Toys & Games
3767,vintage union jack memoboard,Stationery & Craft
276,basket of flowers sewing kit,Toys & Games
187,antique silver tea glass etched,Kitchen & Dining
1206,family album white picture frame,Home Decor
3978,wrap pink fairy cakes,Kitchen & Dining
245,baby boom ribbons,Party & Festive
1177,enamel wash bowl cream,"Health, Beauty & Personal Care"
1993,local cafe mug,Kitchen & Dining
981,diamante bow brooch black colour,Apparel & Accessories
982,diamante bow brooch green colour,Apparel & Accessories
983,diamante bow brooch red colour,Apparel & Accessories
1982,lily brooch amethyst colour,Apparel & Accessories
2383,pair of enamel butterfly hairclip,Apparel & Accessories
154,amethyst diamante expandable ring,Kitchen & Dining
2747,purple gemstone bracelet,Apparel & Accessories
361,black gemstone bracelet,Apparel & Accessories
2748,purple gemstone necklace 45cm,Apparel & Accessories
83,5 strand glass necklace black,Kitchen & Dining
1091,drop diamante earrings crystal,Apparel & Accessories
155,amethyst hoop earring floral leaf,Apparel & Accessories
1611,hanging bauble t-light holder large,Home Decor
928,cut glass hexagon t-light holder,Kitchen & Dining
806,clam shell small,Home Decor
805,clam shell large,Home Decor
834,cockle shell dish,Kitchen & Dining
2457,party pizza dish red retrospot,Party & Festive
3450,spaceboy tv dinner tray,Toys & Games
2642,pink tall porcelain t-light holder,Apparel & Accessories
3874,white tall porcelain t-light holder,Home Decor
1028,dolly girl childrens egg cup,Toys & Games
1852,"key fob , garage design",Apparel & Accessories
1414,garden metal sign,Garden & Outdoor
1851,"key fob , front  door",Apparel & Accessories
1850,"key fob , back door",Apparel & Accessories
3180,set of 6 cake chopsticks,Kitchen & Dining
3197,set of 6 strawberry chopsticks,Kitchen & Dining
791,chrysanthemum pocket book,Stationery & Craft
1417,garden path pocket book,Garden & Outdoor
2795,red daisy pocket book,Stationery & Craft
14,12 pencils tall tube woodland,Stationery & Craft
1384,frog sock puppet,Apparel & Accessories
2590,pink horse sock puppet,Apparel & Accessories
386,black wine glass,Kitchen & Dining
821,classical rose candlestand,Home Decor
1412,gaolers keys decorative garden,Garden & Outdoor
343,black champagne glass,Kitchen & Dining
2839,red retrospot peg bag,Kitchen & Dining
1197,fairy cake design umbrella,Kitchen & Dining
313,big doughnut fridge magnets,Home Decor
3988,"wrap, billboard fonts design",Stationery & Craft
1437,gift bag psychedelic apples,Apparel & Accessories
357,black enchanted forest placemat,Kitchen & Dining
3971,wrap green pears,Stationery & Craft
2831,red retrospot charlotte bag,Kitchen & Dining
2409,paper chain kit empire,Toys & Games
689,charlotte bag pink polkadot,Apparel & Accessories
3598,toy tidy spaceboy,Toys & Games
74,4 rose pink dinner candles,Apparel & Accessories
75,4 sky blue dinner candles,Home Decor
3664,two door curio cabinet,Home Decor
2622,pink polkadot wrap,Apparel & Accessories
217,assorted colours silk fan,Apparel & Accessories
3462,spotty pink duck doorstop,Kitchen & Dining
272,bank charges,Administrative
2845,red retrospot shopper bag,Kitchen & Dining
2829,red retrospot butter dish,Kitchen & Dining
1999,love garland painted zinc,Party & Festive
2069,measuring tape babushka pink,Apparel & Accessories
3736,vintage kid dolly card,Toys & Games
1143,"elephant, birthday card,",Stationery & Craft
476,blue polkadot wrap,Stationery & Craft
3928,woodland charlotte bag,Apparel & Accessories
3686,victorian sewing kit,Toys & Games
2144,mirror love bird t-light holder,Home Decor
368,black love bird t-light holder,Home Decor
1628,hanging jam jar t-light holder,Kitchen & Dining
1597,hand open shape gold,Stationery & Craft
1226,felt farm animal white bunny,Toys & Games
2843,red retrospot purse,Kitchen & Dining
3423,snowstorm photo frame fridge magnet,Home Decor
2821,red polkadot pudding bowl,Kitchen & Dining
473,blue polkadot pudding bowl,Kitchen & Dining
3705,vintage blue tinsel reel,Seasonal
1796,jardin etched glass butter dish,Kitchen & Dining
3437,space frog,Toys & Games
3434,space cadet black,Toys & Games
3435,space cadet red,Toys & Games
3438,space owl,Home Decor
3436,space cadet white,Toys & Games
3929,woodland design  cotton tote bag,Apparel & Accessories
1750,illustrated cat bowl,Kitchen & Dining
3583,toast its - dinosaur,Toys & Games
1418,garden path sketchbook,Garden & Outdoor
465,blue polkadot coffee mug,Kitchen & Dining
2181,monsters stencil craft,Toys & Games
802,citronella candle garden pot,Kitchen & Dining
2172,modern floral stationery set,Stationery & Craft
1407,funky washing up gloves assorted,"Health, Beauty & Personal Care"
1280,floral folk stationery set,Stationery & Craft
475,blue polkadot washing up gloves,"Health, Beauty & Personal Care"
725,childs breakfast set circus parade,Toys & Games
3940,woodland storage box small,Home Decor
3345,skulls  design  cotton tote bag,Apparel & Accessories
1286,flower burst silver ring crystal,Apparel & Accessories
1931,laundry 15c metal sign,Home Decor
1211,fanny's rest stopmetal sign,Apparel & Accessories
748,chocolate this way metal sign,Home Decor
1721,hot baths metal sign,"Health, Beauty & Personal Care"
2716,pottering in the shed metal sign,Kitchen & Dining
1853,"key fob , shed",Apparel & Accessories
2001,love heart pocket warmer,Home Decor
514,botanical lavender birthday card,Stationery & Craft
1476,glass cloche large,Kitchen & Dining
865,corona mexican tray,Kitchen & Dining
1858,kids rain mac blue,Toys & Games
2175,money box confectionery design,Home Decor
2179,money box kings choice design,Home Decor
2180,money box pocket money design,Home Decor
215,assorted colour t-light holder,Home Decor
3820,weekend bag vintage rose paisley,Apparel & Accessories
657,ceramic cake bowl + hanging cakes,Kitchen & Dining
749,christmas card screen print,Seasonal
750,christmas card singing angel,Seasonal
2405,paper bunting vintage paisley,Party & Festive
2448,party invites dinosaurs,Party & Festive
1178,enamel watering can cream,"Health, Beauty & Personal Care"
1168,enamel colander cream,"Health, Beauty & Personal Care"
466,blue polkadot cup,Kitchen & Dining
1400,frying pan union flag,Party & Festive
504,blue/cream stripe cushion cover,"Health, Beauty & Personal Care"
3672,union stripe cushion cover,Home Decor
1849,key cabinet ma campagne,Home Decor
894,cream sweetheart mini chest,"Health, Beauty & Personal Care"
1000,dinosaur party bag + sticker set,Party & Festive
1786,ivy heart wreath,Home Decor
3753,vintage red kitchen cabinet,Toys & Games
1897,large cake stand hanging hearts,Kitchen & Dining
1896,large cake stand  hanging strawbery,Kitchen & Dining
2849,red retrospot sugar jam bowl,Kitchen & Dining
2846,red retrospot shopping bag,Kitchen & Dining
2855,red retrospot washbag,"Health, Beauty & Personal Care"
3561,tea time oven glove,Kitchen & Dining
3497,strawberry fairy cake teapot,Kitchen & Dining
3967,wrap english rose,Stationery & Craft
3948,wrap  pink flock,Apparel & Accessories
3641,tub 24 pink flower pegs,Apparel & Accessories
1250,feng shui pillar candle,Home Decor
974,"decoupage,greeting card,",Stationery & Craft
2246,novelty biscuits cake stand 3 tier,Kitchen & Dining
936,dairy maid toastrack,Kitchen & Dining
937,dairy maid traditional teapot,Kitchen & Dining
1496,glitter heart garland with bells,Party & Festive
1498,glitter star garland with bells,Party & Festive
1660,heart garland rustic padded,Party & Festive
1939,lavender scented fabric heart,"Health, Beauty & Personal Care"
471,blue polkadot passport cover,Apparel & Accessories
3256,set/6 bead coasters gauze bag gold,Kitchen & Dining
1584,grow your own herbs set of 3,Garden & Outdoor
2618,pink polkadot childrens umbrella,Toys & Games
3912,wooden croquet garden set,Garden & Outdoor
3476,star decoration rustic,Party & Festive
3840,white christmas star decoration,Seasonal
1656,heart decoration rustic hanging,Party & Festive
2709,porcelain t-light holders assorted,Home Decor
740,choc truffle gold trinket pot,Kitchen & Dining
3813,wash bag vintage rose paisley,"Health, Beauty & Personal Care"
573,cabin bag vintage paisley,Apparel & Accessories
574,cabin bag vintage retrospot,Kitchen & Dining
2701,poppy's playhouse bathroom,Toys & Games
3601,traditional knitting nancy,Stationery & Craft
3717,vintage cream cat food container,"Health, Beauty & Personal Care"
2190,moroccan tea glass,Kitchen & Dining
1212,faux fur chocolate throw,Home Decor
2929,ribbon reel lace design,Party & Festive
2031,lush greens ribbons,Party & Festive
2354,pack of 6 sandcastle flags assorted,Party & Festive
302,beaded pearl heart white on stick,Home Decor
34,3 hearts hanging decoration rustic,Party & Festive
841,coffee mug dog + ball design,Kitchen & Dining
1679,hearts wrapping tape,Apparel & Accessories
1014,doggy rubber,Stationery & Craft
2048,magic tree -paper flowers,Stationery & Craft
455,blue paisley journal,Stationery & Craft
2224,necklace+bracelet set fruit salad,Apparel & Accessories
1917,large purple babushka notebook,Stationery & Craft
3355,skulls tape,Stationery & Craft
588,cakes and bows gift  tape,Kitchen & Dining
1927,large yellow babushka notebook,Stationery & Craft
1918,large red babushka notebook,Stationery & Craft
156,angel decoration 3 buttons,Party & Festive
107,75 green petit four cases,Kitchen & Dining
3146,set of 36 teatime paper doilies,"Health, Beauty & Personal Care"
2970,rose du sud oven glove,Kitchen & Dining
548,brown check cat doorstop,Administrative
337,black and white cat bowl,Kitchen & Dining
1701,holiday fun ludo,Toys & Games
93,6 ribbons empire,Party & Festive
1877,la palmiera wall thermometer,Home Decor
2312,pack 20 english rose paper napkins,Kitchen & Dining
3227,set/20 strawberry paper napkins,Kitchen & Dining
223,assorted incense pack,"Health, Beauty & Personal Care"
3677,vanilla incense in tin,"Health, Beauty & Personal Care"
4007,yuletide images s/6 paper boxes,Seasonal
64,3d vintage christmas stickers,Seasonal
3230,set/3 floral garden tools in bag,Garden & Outdoor
2946,robot mug in display box,Toys & Games
2366,pack/12 blue folkart cards,Toys & Games
1323,"folk art greeting card,pack/12",Stationery & Craft
3707,vintage caravan greeting card,Stationery & Craft
3217,set of skull wall stickers,Party & Festive
1677,hearts  stickers,Party & Festive
1181,english rose garden secateurs,Garden & Outdoor
222,"assorted flower colour ""leis""",Home Decor
1139,eight piece snake  set,Toys & Games
3363,small camphor wood field  mushroom,Garden & Outdoor
597,camphor wood portobello mushroom,Garden & Outdoor
2653,pink/green flower design big mug,Kitchen & Dining
1290,"flower fairy,5 summer b'draw liners",Home Decor
2813,red love heart shape cup,Kitchen & Dining
2597,pink love heart shape cup,Kitchen & Dining
508,blue/yellow flower design big mug,Kitchen & Dining
1572,green/blue flower design big mug,Kitchen & Dining
2510,pink  heart shape love bucket,Apparel & Accessories
3035,scandinavian paisley picnic bag,Garden & Outdoor
2645,pink vintage paisley picnic bag,Garden & Outdoor
678,charlie and lola charlotte bag,Apparel & Accessories
4003,yellow/pink flower design big mug,Kitchen & Dining
2851,red retrospot tea cup and saucer,Kitchen & Dining
1199,fairy cake notebook a5 size,Kitchen & Dining
1185,english rose notebook a7 size,Stationery & Craft
2186,more butter metal sign,Home Decor
1715,home sweet home metal sign,Garden & Outdoor
2439,party bunting,Party & Festive
3490,strawberries  design flannel,Home Decor
3718,vintage cream dog food container,"Health, Beauty & Personal Care"
1057,doormat neighbourhood witch,Home Decor
2485,pharmacie first aid tin,"Health, Beauty & Personal Care"
2218,natural slate chalkboard large,Stationery & Craft
2093,metal sign his dinner is served,Home Decor
301,beaded pearl heart white large,Home Decor
293,beaded crystal heart blue small,Home Decor
3216,set of salt and pepper toadstools,Kitchen & Dining
2931,ribbon reel polkadots,Party & Festive
2085,metal decoration naughty children,Party & Festive
768,christmas metal postcard with bells,Seasonal
1426,"garland, magic garden 1.8m",Garden & Outdoor
1325,folk art metal star t-light holder,Home Decor
2501,pig keyring with light & sound,Apparel & Accessories
1682,hello sailor blue soap holder,"Health, Beauty & Personal Care"
839,coffee mug blue paisley design,Kitchen & Dining
310,beware of the cat metal sign,Home Decor
62,3d sheet of dog stickers,Party & Festive
61,3d sheet of cat stickers,Party & Festive
285,bathroom set love heart design,"Health, Beauty & Personal Care"
797,cinnamon scented votive candle,"Health, Beauty & Personal Care"
1801,jasmine votive candle,Home Decor
3315,silver mug bone china tree of life,Kitchen & Dining
3935,woodland party bag + sticker set,Party & Festive
1722,hot baths soap holder,"Health, Beauty & Personal Care"
17,12 red rose peg place settings,Home Decor
410,blue circles design monkey doll,Toys & Games
3747,vintage photo album paris days,Stationery & Craft
2105,midnight glamour scarf knitting kit,Toys & Games
1342,frappucino scarf knitting kit,Toys & Games
3343,skull lunch box with cutlery,Kitchen & Dining
2174,money box biscuits design,Home Decor
444,blue leaves and beads phone charm,Apparel & Accessories
362,black gemstone necklace 45cm,Apparel & Accessories
3757,vintage rose bead bracelet black,Apparel & Accessories
505,blue/green shell necklace w pendant,Apparel & Accessories
3333,silver/natural shell necklace,Apparel & Accessories
474,blue polkadot purse,Apparel & Accessories
470,blue polkadot luggage tag,Apparel & Accessories
935,dairy maid stripe mug,Kitchen & Dining
2052,magnets pack of 4 swallows,Home Decor
462,blue patch purse pink heart,Apparel & Accessories
483,blue round compact mirror,Home Decor
3639,tropical luggage tag,Apparel & Accessories
226,assorted monkey suction cup hook,Kitchen & Dining
236,assorted tutti frutti pen,Stationery & Craft
2834,red retrospot luggage tag,Kitchen & Dining
2051,magnets pack of 4 retro photo,Home Decor
204,ass floral print spirit level,DIY & Tools
1408,fuschia flower purse with beads,Apparel & Accessories
2975,rose scent candle in jewelled box,"Health, Beauty & Personal Care"
1013,dog toy with pink crochet skirt,Toys & Games
2193,mouse toy with pink t-shirt,Toys & Games
3231,set/3 ocean scent candle jewel box,"Health, Beauty & Personal Care"
2273,ocean scent candle in jewelled box,"Health, Beauty & Personal Care"
2269,nurse's bag soft toy,Toys & Games
509,bohemian collage stationery set,Stationery & Craft
2660,pink/white ribbed melamine jug,Kitchen & Dining
2840,red retrospot picnic bag,Kitchen & Dining
2173,modern vintage cotton shopping bag,Apparel & Accessories
3491,strawberry   picnic bag,Garden & Outdoor
2550,pink dog bowl,Kitchen & Dining
1482,glass jar kings choice,Kitchen & Dining
1479,glass jar daisy fresh cotton wool,Kitchen & Dining
1484,glass jar peacock bath salts,"Health, Beauty & Personal Care"
282,bathroom scales footprints in sand,"Health, Beauty & Personal Care"
2231,new baroque black photo album,Home Decor
3038,scented velvet lounge candle,"Health, Beauty & Personal Care"
427,blue flock glass candleholder,Kitchen & Dining
3303,silver glitter flower votive holder,Home Decor
1512,gold mug bone china tree of life,Kitchen & Dining
3034,scandinavian 3 hearts napkin ring,Kitchen & Dining
742,chocolate 1 wick morris box candle,Home Decor
1422,gardenia 3 wick morris boxed candle,Garden & Outdoor
41,3 rose morris boxed candles,Home Decor
2523,pink baroque flock candle holder,Apparel & Accessories
3276,sewing box retrospot design,Kitchen & Dining
1242,feltcraft hairband pink and blue,Apparel & Accessories
3552,tea bag plate red retrospot,Kitchen & Dining
1494,glitter hanging butterfly string,Apparel & Accessories
3251,set/4 skull badges,Apparel & Accessories
604,candy shop  sticker sheet,Stationery & Craft
3210,set of 72 pink heart paper doilies,"Health, Beauty & Personal Care"
3185,set of 6 heart chopsticks,Kitchen & Dining
2198,multi hearts  stickers,Party & Festive
1397,frying pan pink polkadot,Kitchen & Dining
1990,little green monster soft toy,Toys & Games
2194,mousey long legs soft toy,Toys & Games
1369,french laundry sign blue metal,Home Decor
2797,red dragonfly helicopter,Toys & Games
2717,pottering mug,Kitchen & Dining
1362,french enamel pot w lid,Kitchen & Dining
1363,french enamel utensil holder,Home Decor
3779,wake up cockerel calendar sign,Stationery & Craft
1164,enamel blue rim coffee container,Kitchen & Dining
1163,enamel blue rim biscuit bin,Kitchen & Dining
3538,"swiss roll towel, pink  spots","Health, Beauty & Personal Care"
1289,flower fairy incense bouquet,"Health, Beauty & Personal Care"
1497,glitter snow pear tree decoration,Party & Festive
649,cat bowl vintage cream,"Health, Beauty & Personal Care"
48,3 white choc morris boxed candles,Home Decor
65,4 blue dinner candles silver flock,Home Decor
951,danish rose round sewing box,Stationery & Craft
905,crystal diamante expandable ring,Kitchen & Dining
3846,white glass chunky charm bracelet,Kitchen & Dining
646,cast iron hook garden fork,Kitchen & Dining
647,cast iron hook garden trowel,Garden & Outdoor
1657,heart decoration with pearls,Party & Festive
2928,ribbon reel hearts design,Party & Festive
167,ant silver lime green boudicca ring,Apparel & Accessories
168,ant silver purple boudicca ring,Apparel & Accessories
3768,vintage union jack pennant,Stationery & Craft
300,beaded love heart jewellery set,Apparel & Accessories
2054,magnets pack of 4 vintage labels,Stationery & Craft
240,asstd design racing car pen,Stationery & Craft
1647,happy stencil craft,Stationery & Craft
202,ass des phone sponge craft sticker,"Health, Beauty & Personal Care"
1338,forked cactus candle,Kitchen & Dining
3530,sweetheart wire fruit bowl,Kitchen & Dining
843,coffee mug pink paisley design,Kitchen & Dining
977,denim patch purse pink butterfly,Apparel & Accessories
3995,yellow flowers felt handbag kit,Toys & Games
3876,white tissue ream,Stationery & Craft
1227,felt toadstool  small,Garden & Outdoor
1222,felt farm animal chicken,Toys & Games
6,12 ivory rose peg place settings,Home Decor
3392,"small pop box,funky monkey",Home Decor
722,childrens garden gloves pink,Toys & Games
940,daisy garden marker,Garden & Outdoor
324,birdhouse garden marker,Garden & Outdoor
3506,stripes design teddy,Toys & Games
2764,rain poncho retrospot,Kitchen & Dining
965,decorative cats bathroom bottle,"Health, Beauty & Personal Care"
277,basket of toadstools,Garden & Outdoor
2511,pink  honeycomb paper ball,"Health, Beauty & Personal Care"
669,ceramic strawberry trinket tray,Kitchen & Dining
692,cherry blossom  decorative flask,Kitchen & Dining
998,dinosaur keyrings assorted,Toys & Games
2428,paperweight childhood memories,Toys & Games
2805,red gingham teddy bear,Toys & Games
2609,pink painted kashmiri chair,Apparel & Accessories
3270,set/6 purple butterfly t-lights,Home Decor
105,75 black petit four cases,Kitchen & Dining
1034,dolly mixture children's umbrella,Toys & Games
887,cream felt easter egg basket,Seasonal
424,blue felt easter egg basket,Seasonal
1329,folkart heart napkin rings,Kitchen & Dining
3496,strawberry dream childs umbrella,Toys & Games
1201,fairy cakes notebook a7 size,Kitchen & Dining
3366,small chocolates pink bowl,Kitchen & Dining
1899,large cake towel pink spots,"Health, Beauty & Personal Care"
16,12 pink rose peg place settings,Apparel & Accessories
3668,union flag windsock,Party & Festive
1277,floor lamp shade wood base,Home Decor
1194,etched glass coaster,Kitchen & Dining
568,butterfly crochet food cover,Kitchen & Dining
2507,ping microwave apron,Kitchen & Dining
2307,oven mitt apples design,Kitchen & Dining
191,apron apple delight,Kitchen & Dining
1446,gingham oven glove red heart,Kitchen & Dining
785,christmas tree heart decoration,Seasonal
772,christmas musical zinc tree,Seasonal
2043,magic drawing slate leap frog,Toys & Games
2481,periwinkle t-light holder,Home Decor
3282,silicon star bulb  blue,Garden & Outdoor
1911,large medina stamped metal bowl,Kitchen & Dining
448,blue netting storage hanger,Home Decor
3549,tablecloth red apples design,Kitchen & Dining
3281,"silicon cube 25w, blue",Home Decor
3259,set/6 collage paper plates,Kitchen & Dining
2202,multicolour honeycomb fan,"Health, Beauty & Personal Care"
2917,retrospot padded seat cushion,Kitchen & Dining
2034,madras notebook large,Stationery & Craft
3119,set of 3 bird light pink feather,Apparel & Accessories
3692,vintage bead notebook,Stationery & Craft
297,beaded crystal heart pink large,Apparel & Accessories
3026,sandalwood fan,Apparel & Accessories
1623,hanging heart jar t-light holder,Kitchen & Dining
2320,pack 6 heart/ice-cream patches,"Health, Beauty & Personal Care"
2607,pink owl soft toy,Toys & Games
3273,set/6 turquoise butterfly t-lights,Home Decor
881,cream and pink flowers pony,"Health, Beauty & Personal Care"
96,6 rocket balloons,Party & Festive
411,blue circles design teddy,Toys & Games
907,crystal frog phone charm,Apparel & Accessories
3431,sombrero,Apparel & Accessories
160,animal stickers,Party & Festive
