product_id,item,category
2584,pink heart of glass bracelet,Kitchen & Dining
152,amber glass/silver bracelet,Kitchen & Dining
1997,long silver necklace pastel flower,Apparel & Accessories
1521,gold/m.o.p pendant orbit necklace,Apparel & Accessories
3330,silver/m.o.p pendant orbit necklace,Apparel & Accessories
1278,floral bathroom set,"Health, Beauty & Personal Care"
1553,green metal swinging bunny,Home Decor
3745,vintage notebook travelogue,Stationery & Craft
3367,small chunky glass roman  bowl,Kitchen & Dining
1474,glass chalice green  large,Kitchen & Dining
1517,gold teddy bear,Toys & Games
341,black bird garden design mug,Kitchen & Dining
18,15 pink fluffy chicks in box,Apparel & Accessories
4018,zinc heart lattice tray oval,Kitchen & Dining
3187,set of 6 ice cream skittles,Toys & Games
415,blue cushion cover with flower,Home Decor
2648,pink yellow patch cushion cover,Apparel & Accessories
110,a4 wall tidy red flowers,Home Decor
2467,peach knitted hen,Home Decor
1751,incense bazaar peach,"Health, Beauty & Personal Care"
3608,tranquility masala incense,"Health, Beauty & Personal Care"
2274,ocean stripe hammock,Garden & Outdoor
3760,vintage shells print,Stationery & Craft
1142,elephant clip w suction cup,Kitchen & Dining
694,cherry blossom decorative flask,Kitchen & Dining
3856,white hydrangea art flower,Home Decor
884,cream climbing hydranga art flower,"Health, Beauty & Personal Care"
490,blue stones on wire for candle,Home Decor
603,candy heart hanging decoration,Party & Festive
1495,glitter heart decoration,Party & Festive
2594,pink jewelled photo frame,Apparel & Accessories
1445,gingham heart decoration,Party & Festive
2573,pink gauze butterfly lampshade,Apparel & Accessories
693,cherry blossom canvas art picture,Home Decor
515,botanical lavender gift wrap,Stationery & Craft
2655,pink/purple retro radio,Apparel & Accessories
2079,medium pink buddha head,Apparel & Accessories
2483,"pet mug, goldfish",Kitchen & Dining
3579,tiny crystal bracelet green,Apparel & Accessories
2221,necklace+bracelet pink butterfly,Apparel & Accessories
1744,ice cream design garden parasol,"Health, Beauty & Personal Care"
3061,set 2 pantry design tea towels,"Health, Beauty & Personal Care"
2123,mini jigsaw leap frog,Toys & Games
2088,metal rabbit ladder easter,Seasonal
2029,lunch box with cutlery fairy cakes,Kitchen & Dining
873,cotton apron pantry design,Kitchen & Dining
1450,girls alphabet iron on patches,Stationery & Craft
533,boys alphabet iron on patches,Stationery & Craft
3877,white travel alarm clock,Home Decor
1281,floral pink monster,Toys & Games
611,candy spot tea cosy,Kitchen & Dining
1747,icon mug revolutionary,Kitchen & Dining
122,"acrylic jewel snowflake, pink",Apparel & Accessories
2681,"pocket mirror ""glamorous""",Home Decor
3843,white enamel flower hair tie,Apparel & Accessories
1536,green enamel flower hair tie,Apparel & Accessories
570,butterfly hair band,Apparel & Accessories
1259,fire polished glass bracelet black,Kitchen & Dining
446,blue murano twist bracelet,Apparel & Accessories
1787,jade crystal+glass bracelet,Kitchen & Dining
2995,ruby glass cluster bracelet,Kitchen & Dining
2102,midnight blue glass/silver bracelet,Kitchen & Dining
2380,painted sea shell metal windchime,Garden & Outdoor
1316,folding shoe tidy,Apparel & Accessories
2035,madras notebook medium,Stationery & Craft
3467,square metal candleholder base,Home Decor
232,assorted tutti frutti keyring ball,Apparel & Accessories
2032,m/colour pom-pom curtain,Home Decor
344,black cherry lights,Home Decor
875,cracked glaze earrings brown,Apparel & Accessories
385,black vintage  crystal earrings,Apparel & Accessories
349,black crystal drop earrings,Apparel & Accessories
3880,white vintage crystal earrings,Apparel & Accessories
3878,white vint art deco crystal necklac,Apparel & Accessories
384,black vint art dec crystal necklace,Apparel & Accessories
2234,new baroque small necklace black,Apparel & Accessories
3525,sweetheart carry-all basket,Home Decor
1980,lilac gauze butterfly lampshade,Home Decor
2654,pink/purple circle curtain,Apparel & Accessories
1432,giant medina stamped metal bowl,Kitchen & Dining
2569,pink flowers rabbit easter,Seasonal
2734,purple amethyst necklace w tassel,Apparel & Accessories
506,blue/nat shell necklace w pendant,Apparel & Accessories
3332,silver/nat shell necklace w pendant,Apparel & Accessories
3313,silver m.o.p orbit drop earrings,Apparel & Accessories
1251,filigree diamante earrings,Apparel & Accessories
1788,jade drop earrings w filigree,Apparel & Accessories
1525,grass hopper wooden wall clock,Home Decor
1778,ivory string curtain with pole,Apparel & Accessories
2636,pink square table clock,Apparel & Accessories
2601,pink monte carlo handbag,Apparel & Accessories
2549,pink disco handbag,Apparel & Accessories
2212,musical zinc heart decoration,Party & Festive
2922,retrospot wooden heart decoration,Party & Festive
1631,hanging metal chicken decoration,Party & Festive
2400,pantry scrubbing brush,"Health, Beauty & Personal Care"
1625,hanging heart with bell,Home Decor
3170,set of 4 pantry jelly moulds,Kitchen & Dining
3610,travel card wallet flower meadow,Apparel & Accessories
3613,travel card wallet pantry,Kitchen & Dining
3616,travel card wallet skulls,Apparel & Accessories
3621,travel card wallet vintage rose,Apparel & Accessories
3618,travel card wallet transport,Apparel & Accessories
3615,travel card wallet retrospot,Kitchen & Dining
3612,travel card wallet keep calm,Apparel & Accessories
1449,giraffe wooden ruler,Stationery & Craft
2923,revolver wooden ruler,Stationery & Craft
2719,potting shed rose candle,Kitchen & Dining
2899,"retro pill box , revolutionary",Home Decor
3614,travel card wallet retro petals,Apparel & Accessories
3617,travel card wallet suki,Toys & Games
3622,travel card wallet vintage ticket,Apparel & Accessories
2399,pantry rolling pin,Kitchen & Dining
3619,travel card wallet union jack,Apparel & Accessories
3611,travel card wallet i love london,Apparel & Accessories
2906,"retro tin ashtray,revolutionary",Kitchen & Dining
1365,french floral cushion cover,Home Decor
1410,fuschia table run flower,Home Decor
1075,dotcomgiftshop tea towel,Administrative
715,childrens cutlery polkadot blue,Toys & Games
717,childrens cutlery polkadot pink,Toys & Games
3011,s/3 pink square planters roses,Garden & Outdoor
2754,purple/copper hanging lampshade,Home Decor
502,blue white plastic rings lampshade,Apparel & Accessories
1509,gold m.o.p orbit drop earrings,Apparel & Accessories
3879,white vintage crystal bracelet,Apparel & Accessories
3308,silver lariat 40cm,Apparel & Accessories
2226,new baroque b'fly necklace crystal,Apparel & Accessories
1464,glass bead hoop necklace amethyst,Kitchen & Dining
3294,silver bracelet w pastel flower,Apparel & Accessories
2227,new baroque b'fly necklace green,Apparel & Accessories
2099,midnight blue copper flower necklac,Apparel & Accessories
862,copper/olive green flower necklace,Apparel & Accessories
2767,raspberry ant copper flower necklac,Apparel & Accessories
1466,glass bead hoop necklace green,Kitchen & Dining
1467,glass bead hoop necklace montana,Kitchen & Dining
2519,pink and black string curtain,Apparel & Accessories
2311,pack 20 dolly pegs,Toys & Games
3536,swiss roll towel pink  spots,"Health, Beauty & Personal Care"
2023,lunch bag suki design,Toys & Games
718,childrens cutlery retrospot red,Toys & Games
716,childrens cutlery polkadot green,Toys & Games
1538,green enamel+glass hair comb,"Health, Beauty & Personal Care"
1548,green heart compact mirror,Home Decor
3942,woven berries cushion cover,Kitchen & Dining
3547,t-light holder white lace,Home Decor
3033,scallop shell soap dish,"Health, Beauty & Personal Care"
1653,heart buttons jewellery box,Apparel & Accessories
2640,pink string curtain with pole,Apparel & Accessories
3593,top secret pen set,Apparel & Accessories
1947,"letter ""a"" bling key ring",Apparel & Accessories
2225,necklace+bracelet set pink daisy,Apparel & Accessories
2222,necklace+bracelet set blue blossom,Apparel & Accessories
3268,set/6 posies paper cups,Kitchen & Dining
1829,jumbo bag scandinavian blue paisley,Apparel & Accessories
2540,pink chrysanthemums art flower,Apparel & Accessories
3481,starfish soap dish,"Health, Beauty & Personal Care"
2626,pink riviera handbag,Apparel & Accessories
308,best dad candle letters,Home Decor
1580,groovy cactus inflatable,Home Decor
1680,heavens scent fragrance oils asstd,"Health, Beauty & Personal Care"
3402,small single flame candle holder,Home Decor
2562,pink felt hanging heart w flower,Apparel & Accessories
289,beach hut shelf w 3 drawers,Home Decor
1404,funky monkey cushion cover,Home Decor
2735,purple anemone artificial flower,Home Decor
3827,white allium  artificial flower,Home Decor
2572,pink foxglove artiifcial flower,Apparel & Accessories
2152,mirrored dove wall decoration,Party & Festive
3589,toilet sign occupied or vacant,"Health, Beauty & Personal Care"
3361,small blue provencal ceramic ball,Kitchen & Dining
2401,pantry washing up brush,"Health, Beauty & Personal Care"
3626,treasure island book box,Stationery & Craft
551,buffalo bill treasure book box,Stationery & Craft
1590,gymkhanna treasure book box,Stationery & Craft
111,abc treasure book box,Stationery & Craft
2398,pantry pastry brush,"Health, Beauty & Personal Care"
1020,dollcraft girl amelie kit,Toys & Games
1021,dollcraft girl nicole,Toys & Games
830,clear stationery box set,Stationery & Craft
1241,feltcraft girl nicole kit,Toys & Games
3945,woven frost cushion cover,Kitchen & Dining
1230,feltcraft boy jean-paul kit,Toys & Games
1240,feltcraft girl amelie kit,Toys & Games
1589,gymkhana treasure book box,Stationery & Craft
2191,mother's kitchen spoon rest,Toys & Games
832,clock magnet mum's kitchen,Toys & Games
1790,jam clock magnet,Kitchen & Dining
2391,pantry apple corer,Kitchen & Dining
2516,pink & white rosebud ring,Apparel & Accessories
3885,white with black cats plate,Kitchen & Dining
2207,mum's kitchen clock,Toys & Games
225,assorted mini madras notebook,Stationery & Craft
3648,turq pendant triple shell necklace,Apparel & Accessories
1557,green pendant triple shell necklace,Apparel & Accessories
354,black drop earrings w long beads,Apparel & Accessories
447,blue murano twist necklace,Apparel & Accessories
2781,recycled acapulco mat red,Apparel & Accessories
2780,recycled acapulco mat pink,Apparel & Accessories
2779,recycled acapulco mat lavender,Apparel & Accessories
2778,recycled acapulco mat green,Apparel & Accessories
2782,recycled acapulco mat turquoise,Apparel & Accessories
2777,recycled acapulco mat blue,Apparel & Accessories
3016,"s/4 icon coaster,elvis lives",Kitchen & Dining
1018,dollcraft boy jean-paul,Toys & Games
1375,french style storage jar jam,Kitchen & Dining
553,bull dog bottle opener,Kitchen & Dining
2543,pink crystal guitar phone charm,Apparel & Accessories
358,black feather christmas decoration,Seasonal
2744,purple foxglove artiifcial flower,Apparel & Accessories
2210,murano style glass bracelet gold,Kitchen & Dining
1457,glass and painted beads bracelet ol,Kitchen & Dining
1456,glass and beads bracelet ivory,Kitchen & Dining
1962,"letter ""p"" bling key ring",Apparel & Accessories
2160,mirrored wall art splodges,Home Decor
3994,yellow felt hanging heart w flower,Home Decor
2755,purple/turq flowers handbag,Apparel & Accessories
900,crochet rose des clothes hanger,Home Decor
440,blue hole punch,Stationery & Craft
247,baby mouse red gingham dress,Apparel & Accessories
554,bull dog bottle top wall clock,Kitchen & Dining
1373,french style storage jar bonbons,Kitchen & Dining
1019,dollcraft girl amelie,Toys & Games
1374,french style storage jar cafe,Kitchen & Dining
3005,"rustic wooden cabinet, glass doors",Kitchen & Dining
4001,yellow/blue retro radio,Home Decor
2900,"retro pill box key chain,the king",Apparel & Accessories
1736,i love london baby gift set,Stationery & Craft
3439,spaceboy baby gift set,Toys & Games
1024,dolly girl baby gift set,Toys & Games
609,candy spot hand bag,Kitchen & Dining
798,circus parade baby gift set,Stationery & Craft
695,cherry blossom luggage tag,Apparel & Accessories
1184,english rose notebook a6 size,Stationery & Craft
2463,pastel pink photo album,Apparel & Accessories
2786,red  egg  spoon,Kitchen & Dining
1681,hello sailor bathroom set,"Health, Beauty & Personal Care"
434,blue glass gems in bag,Kitchen & Dining
1684,hen house w chick in nest,Home Decor
3955,wrap bad hair day,Apparel & Accessories
356,black enamel flower ring,Apparel & Accessories
116,acrylic geometric lamp,Home Decor
2500,piece of camo stationery set,Stationery & Craft
3896,wine bottle dressing lt.blue,Kitchen & Dining
3099,set of 16 vintage ivory cutlery,Kitchen & Dining
1921,large skull windmill,Toys & Games
3944,woven candy cushion cover,Kitchen & Dining
1843,jungle popsicles ice lolly moulds,Kitchen & Dining
2633,pink small glass cake stand,Kitchen & Dining
1274,flag of st george chair,Party & Festive
463,blue polkadot beaker,Kitchen & Dining
185,antique silver t-light glass,Kitchen & Dining
2285,orange flower mug,Kitchen & Dining
3998,yellow pink flower design big bowl,Kitchen & Dining
1359,french chateau oval platter,Kitchen & Dining
227,assorted sanskrit mini notebook,Stationery & Craft
428,blue flower des purse,Apparel & Accessories
1144,elvis wallhanging / curtain,Home Decor
314,big polkadot mug,Kitchen & Dining
1296,"flower glass garld neckl36""turquois",Kitchen & Dining
2812,red kukui coconut seed necklace,Garden & Outdoor
2649,pink/amethyst/gold necklace,Apparel & Accessories
213,assorted colour silk glasses case,Kitchen & Dining
1077,doughnut lip gloss,"Health, Beauty & Personal Care"
1746,ice cream sundae lip gloss,"Health, Beauty & Personal Care"
1745,ice cream pen lip gloss,"Health, Beauty & Personal Care"
2282,open closed metal sign,Stationery & Craft
3895,wine bottle dressing dark blue,Kitchen & Dining
897,crochet bear red/blue  keyring,Apparel & Accessories
2582,pink hawaiian picnic hamper for 2,Garden & Outdoor
1208,fan black frame,Apparel & Accessories
2718,potting shed candle citronella,Kitchen & Dining
3956,wrap billboard fonts design,Stationery & Craft
3178,set of 5 pancake day magnets,Kitchen & Dining
3155,set of 4 jam jar magnets,Kitchen & Dining
3177,set of 5 mini grocery magnets,Home Decor
1871,knickerbockerglory magnet assorted,Home Decor
2319,pack 4 flower/butterfly patches,Stationery & Craft
3176,set of 5 lucky cat magnets,Home Decor
1799,jardin etched glass large bell jar,Kitchen & Dining
2208,mummy mouse red gingham ribbon,Party & Festive
1360,french chateau small fruitbowl,Kitchen & Dining
1357,french chateau large fruit bowl,Kitchen & Dining
172,antique cream cutlery cupboard,"Health, Beauty & Personal Care"
1192,envelope 50 romantic images,Stationery & Craft
2630,pink rosebud pearl bracelet,Apparel & Accessories
2602,pink murano twist necklace,Apparel & Accessories
1555,green murano twist necklace,Apparel & Accessories
1526,green  diamante pen in gift box,Stationery & Craft
3959,wrap carousel,Stationery & Craft
2223,necklace+bracelet set blue hibiscus,Apparel & Accessories
2284,orange felt vase + flowers,Home Decor
3189,set of 6 nativity magnets,Home Decor
3328,silver/black orbit necklace,Apparel & Accessories
3691,vintage bead cosmetic bag,"Health, Beauty & Personal Care"
1165,enamel blue rim tea container,Kitchen & Dining
288,beach hut mirror,Home Decor
2145,mirror mosaic candle plate,Kitchen & Dining
1687,hen house with chick standing,Home Decor
372,black photo album,Home Decor
3642,tumbler baroque,Kitchen & Dining
1522,goldie looking mirror,Home Decor
2631,pink round compact mirror,Apparel & Accessories
489,blue square compact mirror,Home Decor
2147,mirror mosaic hurricane lamp,Home Decor
963,decoration wobbly chicken,Party & Festive
964,decoration wobbly rabbit metal,Party & Festive
3568,teatime funky flower backpack for 2,Kitchen & Dining
714,childrens cutlery dolly girl,Toys & Games
719,childrens cutlery spaceboy,Toys & Games
2228,new baroque b'fly necklace pink,Apparel & Accessories
713,childrens cutlery circus parade,Toys & Games
3643,tumbler new england,Kitchen & Dining
516,botanical lily gift wrap,Stationery & Craft
182,antique opal white flower earrings,Apparel & Accessories
274,baroque butterfly earrings black,Apparel & Accessories
2185,mop pendant shell necklace,Apparel & Accessories
4002,yellow/orange flower design plate,Kitchen & Dining
691,charlotte bag vintage alphabet,Apparel & Accessories
1818,jumbo bag alphabet,Apparel & Accessories
2011,lunch bag alphabet design,Apparel & Accessories
1819,jumbo bag apples,Apparel & Accessories
2012,lunch bag apple design,Apparel & Accessories
687,charlotte bag apples design,Apparel & Accessories
686,charlotte bag alphabet  design,Apparel & Accessories
1857,kids cutlery spaceboy,Toys & Games
1856,kids cutlery dolly girl,Toys & Games
2026,lunch bag vintage leaf design,Apparel & Accessories
1649,hardman mug 3 assorted,Kitchen & Dining
3009,s/2 beach hut treasure chests,Home Decor
453,blue padded soft mobile,Home Decor
2559,pink feathers curtain,Apparel & Accessories
3943,woven bubble gum cushion cover,Kitchen & Dining
3946,woven rose garden cushion cover,Kitchen & Dining
3947,woven sunset cushion cover,Kitchen & Dining
2370,pads to match all cushions,Home Decor
3470,squarecushion cover pink union jack,Apparel & Accessories
30,3 birds canvas screen,Home Decor
1906,large deco jewellery stand,Apparel & Accessories
2461,pastel blue photo album,Home Decor
1652,heart beaded trellis decoration,Party & Festive
1428,gemstone chandelier t-light holder,Home Decor
290,beaded chandelier t-light holder,Home Decor
3368,small deco jewellery stand,Apparel & Accessories
143,aluminium stamped heart,Stationery & Craft
1076,double ceramic parlour hook,Home Decor
4025,zinc sweetheart wire letter rack,Home Decor
2438,parlour ceramic wall hook,Home Decor
1430,georgian trinket box,Home Decor
902,crochet white rabbit keyring,Apparel & Accessories
3095,set of 12 rose botanical t-lights,Home Decor
406,blue cat biscuit barrel pink heart,Apparel & Accessories
3632,triple hook antique ivory rose,Home Decor
3723,vintage embossed heart,Stationery & Craft
1519,gold wine goblet,Kitchen & Dining
1500,gold aperitif glass,Kitchen & Dining
1756,ivory chandelier t-light holder,Home Decor
1303,flowers chandelier t-light holder,Home Decor
3634,triple wire hook ivory heart,Home Decor
3635,triple wire hook pink heart,Apparel & Accessories
3411,small zinc heart wall organiser,Home Decor
3379,small ivory heart wall organiser,Home Decor
2063,marie antoienett trinket box gold,Home Decor
1780,ivory sweetheart wire letter rack,Home Decor
1929,large zinc heart wall organiser,Home Decor
1909,large ivory heart wall organiser,Home Decor
99,60 gold and silver fairy cake cases,Kitchen & Dining
3334,single antique rose hook ivory,Home Decor
2137,miniature antique rose hook ivory,Toys & Games
4028,zinc t-light holder stars small,Home Decor
1784,ivory wire kitchen organiser,Toys & Games
1785,ivory wire sweetheart letter tray,Kitchen & Dining
3337,single wire hook pink heart,Apparel & Accessories
3336,single wire hook ivory heart,Home Decor
1779,ivory sweetheart soap dish,"Health, Beauty & Personal Care"
4026,zinc t-light holder star large,Home Decor
21,16 piece cutlery set pantry design,Kitchen & Dining
4032,zinc wire sweetheart letter tray,Kitchen & Dining
2374,painted lightbulb rainbow design,Garden & Outdoor
1981,lilac votive candle,Home Decor
3569,teatime gel pens asst,"Health, Beauty & Personal Care"
2290,orange/wht/fuschia stones necklace,Apparel & Accessories
3890,white/pink mini crystals necklace,Apparel & Accessories
872,cote d'azure necklace,Apparel & Accessories
3825,white  rosebud pearl bracelet,Apparel & Accessories
2629,pink rosebud & pearl necklace,Apparel & Accessories
3864,white rosebud & pearl necklace,Apparel & Accessories
3472,st tropez necklace,Apparel & Accessories
2943,riviera necklace,Apparel & Accessories
878,cracked glaze necklace red,Apparel & Accessories
1125,edwardian photo frame,Home Decor
2066,maxwell 2 tone blue 60 page photo a,Home Decor
2167,mistletoe heart wreath cream,"Health, Beauty & Personal Care"
1618,hanging engraved metal heart,Home Decor
494,blue table run flower,Home Decor
492,blue stripes shoulder bag,Apparel & Accessories
408,blue check bag w handle 34x20cm,Administrative
1930,laser cut multi strand necklace,Apparel & Accessories
2880,regency sugar tongs,Kitchen & Dining
1054,doormat keep calm and come in,Home Decor
1067,doormat vintage leaves design,Stationery & Craft
1537,green enamel flower ring,Apparel & Accessories
2799,red enamel flower ring,Apparel & Accessories
2742,purple enamel flower ring,Apparel & Accessories
652,cd wall tidy blue office,Home Decor
2885,regency tea strainer,Kitchen & Dining
3412,small zinc/glass candleholder,Kitchen & Dining
1506,gold flower cushion cover,Home Decor
3088,set of 10 lanterns fairy light star,Home Decor
2420,paper lantern 7 point snow star,Stationery & Craft
2426,paper lantern 9 point snow star,Stationery & Craft
796,cinderella chandelier,Home Decor
391,bling key ring stand,Apparel & Accessories
2168,mistletoe heart wreath green,Home Decor
3826,white 3 frame birds and tree,Home Decor
1368,french lattice cushion cover,Home Decor
3984,wrap summer rose design,Stationery & Craft
2884,regency tea spoon,Kitchen & Dining
2874,regency cake fork,Kitchen & Dining
2875,regency cake slice,Kitchen & Dining
179,antique ivory wire bowl small,Kitchen & Dining
2138,miniture antique rose hook ivory,Home Decor
2564,pink flock photo frame,Apparel & Accessories
4031,zinc wire kitchen organiser,Toys & Games
1335,food cover with beads set 2,Kitchen & Dining
3461,spotty bunting,Party & Festive
1120,edwardian heart photo frame,Home Decor
4024,zinc sweetheart soap dish,"Health, Beauty & Personal Care"
913,crystal stud earrings clear display,Toys & Games
2423,paper lantern 9 point holly star 40,Stationery & Craft
2417,paper lantern 5 point star moon 30,Stationery & Craft
2419,paper lantern 6 point snow star,Stationery & Craft
2520,pink and white christmas tree 120cm,Seasonal
564,"bunting , spotty",Party & Festive
2692,polyester filler pad 60x40cm,Home Decor
419,blue disco handbag,Apparel & Accessories
2014,lunch bag doiley pattern,"Health, Beauty & Personal Care"
1825,jumbo bag pears,Apparel & Accessories
1821,jumbo bag doiley patterns,"Health, Beauty & Personal Care"
2182,montana diamond cluster earrings,Apparel & Accessories
2064,marie antoinette trinket box gold,Home Decor
2065,marie antoinette trinket box silver,Home Decor
1837,jumbo bag vintage leaf,Apparel & Accessories
2424,paper lantern 9 point holly star l,Stationery & Craft
2421,paper lantern 9 point deluxe star,Stationery & Craft
2415,paper lantern 5 point sequin star,Stationery & Craft
2425,paper lantern 9 point holly star s,Stationery & Craft
2422,paper lantern 9 point holly star 23,Stationery & Craft
2418,paper lantern 5 point studded star,Stationery & Craft
1334,"food cover with beads , set 2 sizes",Kitchen & Dining
2768,rasta in bath w spliff ashtray,"Health, Beauty & Personal Care"
1291,flower garland necklace red,Party & Festive
1776,ivory shell heart earrings,Apparel & Accessories
3649,turq stone/crystal earrings,Apparel & Accessories
1293,"flower glass garland neckl.36""blue",Party & Festive
1310,folding butterfly mirror ivory,Home Decor
1309,folding butterfly mirror hot pink,Apparel & Accessories
558,bundle of 3 school exercise books,Stationery & Craft
557,bundle of 3 retro note books,Stationery & Craft
1547,green goose feather tree 60cm,Home Decor
2577,pink goose feather tree 60cm,Apparel & Accessories
3848,white goose feather tree 60cm,Home Decor
556,bundle of 3 retro exercise books,Stationery & Craft
2877,regency milk jug pink,Kitchen & Dining
2879,regency sugar bowl green,Kitchen & Dining
2886,regency teapot roses,Kitchen & Dining
2882,regency tea plate pink,Kitchen & Dining
2881,regency tea plate green,Kitchen & Dining
2883,regency tea plate roses,Kitchen & Dining
1551,green metal box army supplies,Home Decor
2762,rabbit night light,Home Decor
1311,folding butterfly mirror red,Home Decor
2435,parisienne jewellery drawer,Apparel & Accessories
2484,petit tray chic,Kitchen & Dining
4020,zinc herb garden container,Garden & Outdoor
1942,le grand tray chic set,Kitchen & Dining
3089,set of 10 led dolly lights,Toys & Games
2815,red metal box top secret,Apparel & Accessories
1552,green metal box top secret,Apparel & Accessories
2436,parisienne key cabinet,Home Decor
555,bundle of 3 alphabet exercise books,Stationery & Craft
3290,silver bells table decoration,Party & Festive
3305,silver hearts table decoration,Party & Festive
3726,vintage engraved heart,Stationery & Craft
3082,set 6 paper table lantern hearts,Stationery & Craft
1304,flowers handbag blue and orange,Apparel & Accessories
3385,small parisienne heart photo frame,Home Decor
1313,folding mirror hot pink,Apparel & Accessories
1945,led tea lights,Kitchen & Dining
305,bell heart decoration,Party & Festive
142,aluminium heart,Home Decor
903,crystal chandelier t-light holder,Home Decor
2434,parisienne curio cabinet,Home Decor
2437,parisienne sewing box,Stationery & Craft
3580,toadstool bedside light,Garden & Outdoor
3364,small ceramic top storage jar,Kitchen & Dining
1768,ivory pantry hanging lamp,Kitchen & Dining
819,classic sugar dispenser,Kitchen & Dining
1928,large zinc glass candleholder,Kitchen & Dining
2166,miseltoe heart wreath white,Home Decor
2164,miseltoe heart wreath,Home Decor
817,classic glass sweet jar,Kitchen & Dining
1902,large ceramic top storage jar,Kitchen & Dining
1910,large jewellery stand,Apparel & Accessories
3380,small jewellery stand,Apparel & Accessories
3323,silver stars table decoration,Party & Festive
1470,glass bon bon jar,Kitchen & Dining
3884,white wire plant pot holder,Kitchen & Dining
816,classic glass cookie jar,Kitchen & Dining
1260,fire polished glass bracelet green,Kitchen & Dining
1261,fire polished glass bracelet montan,Kitchen & Dining
