product_id,item,category
3851,white hanging heart t-light holder,Home Decor
3859,white metal lantern,Home Decor
885,cream cupid hearts coat hanger,"Health, Beauty & Personal Care"
1873,knitted union flag hot water bottle,Party & Festive
2871,red woolly hottie white heart.,"Health, Beauty & Personal Care"
3085,set 7 babushka nesting boxes,Home Decor
1487,glass star frosted t-light holder,Kitchen & Dining
1609,hand warmer union jack,"Health, Beauty & Personal Care"
1606,hand warmer red polka dot,"Health, Beauty & Personal Care"
209,assorted colour bird ornament,Home Decor
2702,poppy's playhouse bedroom,Toys & Games
2703,poppy's playhouse kitchen,Toys & Games
1246,feltcraft princess charlotte doll,Toys & Games
1766,ivory knitted mug cosy,Kitchen & Dining
525,box of 6 assorted colour teaspoons,Kitchen & Dining
531,box of vintage jigsaw blocks,Toys & Games
530,box of vintage alphabet blocks,Stationery & Craft
1703,home building block word,Toys & Games
1998,love building block word,Toys & Games
2774,recipe box with metal heart,Home Decor
1058,doormat new england,Home Decor
1795,jam making set with jars,Kitchen & Dining
2793,red coat rack paris fashion,Apparel & Accessories
3991,yellow coat rack paris fashion,Apparel & Accessories
413,blue coat rack paris fashion,Apparel & Accessories
278,bath building block word,Toys & Games
138,alarm clock bakelike pink,Apparel & Accessories
139,alarm clock bakelike red,Home Decor
135,alarm clock bakelike green,Home Decor
2389,panda and bunnies sticker sheet,Kitchen & Dining
3482,stars gift tape,Stationery & Craft
1752,inflatable political globe,Home Decor
3730,vintage heads and tails card game,Toys & Games
3225,set/2 red retrospot tea towels,"Health, Beauty & Personal Care"
2990,round snack boxes set of4 woodland,Kitchen & Dining
3446,spaceboy lunch box,Toys & Games
2028,lunch box i love london,Kitchen & Dining
800,circus parade lunch box,Kitchen & Dining
688,charlotte bag dolly girl design,Toys & Games
2867,red toadstool led night light,Garden & Outdoor
3062,set 2 tea towels i love london,"Health, Beauty & Personal Care"
3759,vintage seaside jigsaw puzzles,Toys & Games
2119,mini jigsaw circus parade,Toys & Games
2125,mini jigsaw spaceboy,Toys & Games
2129,mini paint set vintage,Stationery & Craft
2711,postage,Administrative
2408,paper chain kit 50's christmas,Seasonal
1124,edwardian parasol red,Garden & Outdoor
2895,retro coffee mugs assorted,Kitchen & Dining
3031,save the planet mug,Kitchen & Dining
3700,vintage billboard drink me mug,Kitchen & Dining
3701,vintage billboard love/hate mug,Kitchen & Dining
3899,wood 2 drawer cabinet white finish,Home Decor
3902,wood s/3 cabinet ant white finish,Home Decor
3917,wooden picture frame white finish,Home Decor
3913,wooden frame antique white,Home Decor
3683,victorian sewing box large,Stationery & Craft
1729,hot water bottle tea and sympathy,"Health, Beauty & Personal Care"
2807,red hanging heart t-light holder,Home Decor
1826,jumbo bag pink polkadot,Apparel & Accessories
1816,jumbo  bag baroque black white,Apparel & Accessories
1820,jumbo bag charlie and lola toys,Toys & Games
3495,strawberry charlotte bag,Apparel & Accessories
2788,red 3 piece retrospot cutlery set,Kitchen & Dining
400,blue 3 piece polkadot cutlery set,Kitchen & Dining
3272,set/6 red spotty paper plates,Kitchen & Dining
2018,lunch bag red retrospot,Kitchen & Dining
3499,strawberry lunch box with cutlery,Kitchen & Dining
2030,lunch box with cutlery retrospot,Kitchen & Dining
2363,pack of 72 retrospot cake cases,Kitchen & Dining
2359,pack of 60 dinosaur cake cases,Toys & Games
2361,pack of 60 pink paisley cake cases,Kitchen & Dining
100,60 teatime fairy cake cases,Kitchen & Dining
3590,tomato charlie+lola coaster set,Kitchen & Dining
675,charlie & lola wastepaper bin flora,Stationery & Craft
2792,red charlie+lola personal doorsign,Home Decor
1841,jumbo storage bag suki,Toys & Games
1827,jumbo bag pink vintage paisley,Apparel & Accessories
1794,jam making set printed,Kitchen & Dining
2921,retrospot tea set ceramic 11 pc,Kitchen & Dining
1452,girly pink tool set,Garden & Outdoor
1839,jumbo shopper vintage red paisley,Apparel & Accessories
133,"airline lounge,metal sign",Home Decor
3869,white spot red ceramic drawer knob,Kitchen & Dining
2798,red drawer knob acrylic edwardian,Home Decor
827,clear drawer knob acrylic edwardian,Home Decor
2486,photo clip line,Home Decor
1219,felt egg cosy chicken,Kitchen & Dining
2503,piggy bank retrospot,Kitchen & Dining
3344,skull shoulder bag,Apparel & Accessories
4005,you're confusing me metal sign,Home Decor
857,cook with wine metal sign,Kitchen & Dining
1439,gin + tonic diet metal sign,Home Decor
3990,yellow breakfast cup and saucer,Kitchen & Dining
2529,pink breakfast cup and saucer,Kitchen & Dining
2411,paper chain kit retrospot,Toys & Games
3377,small heart flowers hook,Home Decor
3559,tea time des tea cosy,Kitchen & Dining
1221,felt egg cosy white rabbit,Kitchen & Dining
4030,zinc willie winkie  candle stick,Home Decor
661,ceramic cherry cake money bank,Kitchen & Dining
2916,retrospot large milk jug,Kitchen & Dining
3182,set of 6 funky beakers,Kitchen & Dining
1121,edwardian parasol black,Garden & Outdoor
1122,edwardian parasol natural,Garden & Outdoor
666,ceramic strawberry cake money bank,Kitchen & Dining
452,blue owl soft toy,Toys & Games
267,balloon art make your own flowers,Party & Festive
1477,glass cloche small,Kitchen & Dining
1588,gumball monochrome coat rack,Apparel & Accessories
1050,doormat fancy font home sweet home,Garden & Outdoor
3761,vintage snakes & ladders,Stationery & Craft
745,chocolate calculator,Stationery & Craft
2784,recycling bag retrospot,Kitchen & Dining
3597,toy tidy pink polkadot,Toys & Games
174,antique glass dressing table pot,Kitchen & Dining
1760,ivory giant garden thermometer,Garden & Outdoor
43,3 tier cake tin green and cream,"Health, Beauty & Personal Care"
44,3 tier cake tin red and cream,"Health, Beauty & Personal Care"
3067,set 3 wicker oval baskets w lids,Home Decor
3901,wood black board ant white finish,Home Decor
845,colour glass t-light holder hanging,Kitchen & Dining
1632,hanging metal heart lantern,Home Decor
1630,hanging medina lantern small,Home Decor
2219,natural slate heart chalkboard,Stationery & Craft
1666,heart of wicker small,Home Decor
1665,heart of wicker large,Home Decor
3858,white lovebird lantern,Home Decor
818,classic metal birdcage plant holder,Garden & Outdoor
889,cream heart card holder,"Health, Beauty & Personal Care"
1171,enamel flower jug cream,"Health, Beauty & Personal Care"
1170,enamel fire bucket cream,"Health, Beauty & Personal Care"
1167,enamel bread bin cream,"Health, Beauty & Personal Care"
1822,jumbo bag dolly girl design,Toys & Games
3600,traditional christmas ribbons,Seasonal
2293,organiser wood antique white,Home Decor
2015,lunch bag dolly girl design,Toys & Games
3883,white wire egg holder,Home Decor
1828,jumbo bag red retrospot,Kitchen & Dining
738,chilli lights,Home Decor
1975,light garland butterfiles pink,Party & Festive
3916,wooden owls light garland,Party & Festive
1205,fairy tale cottage nightlight,Stationery & Craft
1705,home small wood letters,Garden & Outdoor
1444,gingham heart  doorstop red,Apparel & Accessories
1271,five heart hanging decoration,Party & Festive
205,assorted bottle top  magnets,Kitchen & Dining
1381,fridge magnets us diner assorted,Home Decor
1717,homemade jam scented candles,"Health, Beauty & Personal Care"
1380,fridge magnets les enfants assorted,Apparel & Accessories
2964,rose caravan doorstop,Apparel & Accessories
79,5 hook hanger magic toadstool,Garden & Outdoor
765,christmas lights 10 reindeer,Seasonal
3765,vintage union jack cushion cover,Stationery & Craft
3124,set of 3 coloured  flying ducks,Home Decor
3126,set of 3 gold flying ducks,Home Decor
2854,red retrospot umbrella,Kitchen & Dining
388,black/blue polkadot umbrella,Apparel & Accessories
2796,red diner wall clock,Home Decor
418,blue diner wall clock,Home Decor
1757,ivory diner wall clock,Home Decor
1908,large heart measuring spoons,Kitchen & Dining
3378,small heart measuring spoons,Kitchen & Dining
1793,jam jar with pink lid,Kitchen & Dining
1792,jam jar with green lid,Kitchen & Dining
2966,rose cottage keepsake box,Stationery & Craft
1626,hanging heart zinc t-light holder,Home Decor
2413,paper chain kit vintage christmas,Seasonal
1002,disco ball christmas decoration,Seasonal
3393,small popcorn holder,Home Decor
1916,large popcorn holder,Home Decor
3226,set/20 red retrospot paper napkins,Kitchen & Dining
3271,set/6 red spotty paper cups,Kitchen & Dining
2687,polkadot rain hat,Apparel & Accessories
976,deluxe sewing kit,Toys & Games
2914,retrospot heart hot water bottle,"Health, Beauty & Personal Care"
1182,english rose hot water bottle,"Health, Beauty & Personal Care"
2487,photo cube,Home Decor
42,3 stripey mice feltcraft,Stationery & Craft
3195,set of 6 soldier skittles,Toys & Games
3606,traditional wooden skipping rope,Toys & Games
3911,wooden box of dominoes,Toys & Games
2999,rustic  seventeen drawer sideboard,Home Decor
2445,party cones carnival assorted,Party & Festive
2442,party cones candy assorted,Party & Festive
2496,picnic basket wicker small,Garden & Outdoor
3475,star decoration painted zinc,Party & Festive
2915,retrospot lamp,Kitchen & Dining
1209,"fancy font birthday card,",Apparel & Accessories
1608,hand warmer scotty dog design,"Health, Beauty & Personal Care"
1604,hand warmer owl design,"Health, Beauty & Personal Care"
1607,hand warmer red retrospot,"Health, Beauty & Personal Care"
1009,dog bowl chasing ball design,Kitchen & Dining
833,clothes pegs retrospot pack 24,Kitchen & Dining
1598,hand over the chocolate   sign,Home Decor
3623,travel sewing kit,Toys & Games
365,black heart card holder,Stationery & Craft
706,chick grey hot water bottle,"Health, Beauty & Personal Care"
3372,small glass heart trinket pot,Kitchen & Dining
136,alarm clock bakelike ivory,Home Decor
137,alarm clock bakelike orange,Home Decor
1603,hand warmer bird design,"Health, Beauty & Personal Care"
1758,ivory embroidered quilt,Home Decor
3120,set of 3 black flying ducks,Home Decor
2334,pack of 12 red retrospot tissues,"Health, Beauty & Personal Care"
2836,red retrospot mug,Kitchen & Dining
244,babushka lights string of 10,Apparel & Accessories
1049,doormat fairy cake,Kitchen & Dining
3493,strawberry ceramic trinket box,Home Decor
2552,pink doughnut trinket pot,Kitchen & Dining
3284,silk purse babushka pink,Apparel & Accessories
1726,hot water bottle i am so poorly,"Health, Beauty & Personal Care"
746,chocolate hot water bottle,"Health, Beauty & Personal Care"
3866,white skull hot water bottle,"Health, Beauty & Personal Care"
3040,scottie dog hot water bottle,"Health, Beauty & Personal Care"
320,bird house hot water bottle,"Health, Beauty & Personal Care"
523,boudoir square tissue box,Stationery & Craft
3352,skulls square tissue box,Stationery & Craft
2489,photo frame cornice,Home Decor
3285,silk purse babushka red,Apparel & Accessories
2498,picture dominoes,Toys & Games
3020,s/6 sew on crochet flowers,Home Decor
3036,scandinavian reds ribbons,Party & Festive
270,balloons  writing set,Party & Festive
1937,lavender incense in tin,"Health, Beauty & Personal Care"
3663,tv dinner tray vintage paisley,Kitchen & Dining
3152,set of 4 english rose placemats,Kitchen & Dining
3151,set of 4 english rose coasters,Kitchen & Dining
3633,triple photo frame cornice,Home Decor
1207,family photo frame cornice,Home Decor
2151,mirrored disco ball,Party & Festive
1003,disco ball rotator battery operated,Party & Festive
3311,silver looking mirror,Home Decor
1878,ladies & gentlemen metal sign,Home Decor
2092,metal sign her dinner is served,Home Decor
1063,doormat topiary,Apparel & Accessories
281,bathroom metal sign,"Health, Beauty & Personal Care"
1865,kitchen metal sign,Toys & Games
3588,toilet metal sign,"Health, Beauty & Personal Care"
2095,metal sign take it or leave it,Home Decor
1741,i'm on holiday metal sign,Home Decor
1582,grow your own basil in enamel mug,Kitchen & Dining
3221,set/10 pink polkadot party candles,Party & Festive
3063,set 20 napkins fairy cakes design,Kitchen & Dining
3201,set of 6 t-lights snowmen,Home Decor
3200,set of 6 t-lights santa,Seasonal
3214,set of 9 heart shaped balloons,Party & Festive
3027,sandwich bath sponge,"Health, Beauty & Personal Care"
190,apple bath sponge,"Health, Beauty & Personal Care"
3492,strawberry bath sponge,"Health, Beauty & Personal Care"
373,black pirate treasure chest,Home Decor
3477,star portable table light,Home Decor
3422,snowflake portable table light,Home Decor
2605,pink oval jewelled mirror,Apparel & Accessories
2912,retrospot cigar box matches,Kitchen & Dining
868,cosy hour giant tube matches,Home Decor
1803,jazz hearts purse notebook,Apparel & Accessories
600,candleholder pink hanging heart,Apparel & Accessories
212,assorted colour mini cases,Kitchen & Dining
2021,lunch bag spaceboy design,Toys & Games
2027,lunch bag woodland,Apparel & Accessories
2017,lunch bag pink polkadot,Apparel & Accessories
1586,gumball coat rack,Apparel & Accessories
449,blue new baroque candlestick candle,Home Decor
2604,pink new baroquecandlestick candle,Apparel & Accessories
1198,fairy cake flannel assorted colour,Kitchen & Dining
538,bread bin diner style pink,Kitchen & Dining
3563,tea time table cloth,Kitchen & Dining
1724,hot water bottle babushka,"Health, Beauty & Personal Care"
1662,heart ivory trellis small,Home Decor
2553,pink drawer knob acrylic edwardian,Apparel & Accessories
1533,green drawer knob acrylic edwardian,Home Decor
421,blue drawer knob acrylic edwardian,Home Decor
3081,set 6 football celebration candles,Home Decor
3183,set of 6 girls celebration candles,Home Decor
2960,romantic pinks ribbons,Party & Festive
542,bright blues ribbons,Party & Festive
744,chocolate box ribbons,Party & Festive
2449,party invites football,Party & Festive
2450,party invites jazz hearts,Party & Festive
2451,party invites spaceman,Party & Festive
3121,set of 3 butterfly cookie cutters,Kitchen & Dining
3128,set of 3 heart cookie cutters,Kitchen & Dining
37,3 piece spaceboy cookie cutter set,Toys & Games
2364,pack of 72 skull cake cases,Kitchen & Dining
2362,pack of 60 spaceboy cake cases,Toys & Games
104,72 sweetheart fairy cake cases,Kitchen & Dining
2022,lunch bag suki  design,Toys & Games
2013,lunch bag cars blue,Apparel & Accessories
2010,lunch bag  black skull.,Apparel & Accessories
1661,heart ivory trellis large,Home Decor
3254,set/5 red retrospot lid glass bowls,Kitchen & Dining
2040,magic drawing slate dinosaur,Toys & Games
2037,magic drawing slate bake a cake,Toys & Games
13,12 pencils tall tube skulls,Stationery & Craft
2787,red  harmonica in box,Home Decor
438,blue harmonica in box,Home Decor
3347,skulls  water transfer tattoos,Toys & Games
2314,pack 3 boxes bird pannetone,Kitchen & Dining
3116,set of 20 kids cookie cutters,Toys & Games
1,10 colour spaceboy pen,Toys & Games
3682,victorian glass hanging t-light,Kitchen & Dining
3335,single heart zinc t-light holder,Home Decor
1634,hanging metal star lantern,Home Decor
3304,silver hanging t-light holder,Home Decor
1060,doormat red retrospot,Kitchen & Dining
1051,doormat hearts,Home Decor
2220,natural slate rectangle chalkboard,Stationery & Craft
2008,lovebird hanging decoration white,Party & Festive
2479,pens assorted funny face,Stationery & Craft
624,card circus parade,Stationery & Craft
3963,wrap cowboys,Stationery & Craft
131,airline bag vintage tokyo 78,Apparel & Accessories
3211,set of 72 retrospot paper  doilies,"Health, Beauty & Personal Care"
2668,plasters in tin skulls,"Health, Beauty & Personal Care"
3358,sleeping cat erasers,Apparel & Accessories
621,card birthday cowboy,Stationery & Craft
2316,pack 3 boxes christmas pannetone,Seasonal
2979,rotating silver angels t-light hldr,"Health, Beauty & Personal Care"
2930,ribbon reel making snowmen,Party & Festive
76,4 traditional spinning tops,Apparel & Accessories
250,bag 500g swirly marbles,Toys & Games
84,5 strand glass necklace crystal,Kitchen & Dining
3469,squarecushion cover pink union flag,Party & Festive
3444,spaceboy childrens egg cup,Toys & Games
710,children's spaceboy mug,Toys & Games
1234,feltcraft cushion owl,Stationery & Craft
342,black candelabra t-light holder,Home Decor
3596,toy tidy dolly girl design,Toys & Games
3058,set 12 lavender  botanical t-lights,Home Decor
3669,union jack flag luggage tag,Party & Festive
2808,red heart luggage tag,Apparel & Accessories
2806,red glass tassle bag charm,Kitchen & Dining
825,clear acrylic faceted bangle,Apparel & Accessories
1065,doormat union jack guns and roses,Home Decor
3678,vanilla scent candle jewelled box,"Health, Beauty & Personal Care"
1401,full english breakfast plate,Kitchen & Dining
2039,magic drawing slate circus parade,Toys & Games
761,christmas hanging heart with bell,Seasonal
585,cake stand victorian filigree med,Kitchen & Dining
2387,paisley pattern  stickers,Party & Festive
1302,flowers  stickers,Party & Festive
367,black love bird candle,Home Decor
2459,party time pencil erasers,Party & Festive
2521,pink b'fly c/cover w bobbles,Apparel & Accessories
2643,pink union jack  luggage tag,Apparel & Accessories
92,6 ribbons elegant christmas,Seasonal
127,aged glass silver t-light holder,Kitchen & Dining
511,boom box speaker girls,Home Decor
95,6 ribbons shimmering pinks,Party & Festive
1823,jumbo bag owls,Apparel & Accessories
2309,owl doorstop,Apparel & Accessories
2378,painted metal star with holly bells,Home Decor
2376,painted metal heart with holly bell,Home Decor
158,angel decoration stars on dress,Party & Festive
1832,jumbo bag strawberry,Apparel & Accessories
3501,strawberry shopper bag,Apparel & Accessories
2988,round snack boxes set of 4 fruits,Kitchen & Dining
2989,round snack boxes set of 4 skulls,Kitchen & Dining
1029,dolly girl lunch box,Toys & Games
1560,green polkadot plate,Kitchen & Dining
472,blue polkadot plate,Kitchen & Dining
2841,red retrospot plate,Kitchen & Dining
2514,pink  polkadot plate,Kitchen & Dining
1238,feltcraft doll molly,Toys & Games
1232,feltcraft christmas fairy,Seasonal
3130,set of 3 notebooks in parcel,Stationery & Craft
2850,red retrospot tape,Kitchen & Dining
870,cosy slipper shoes small  red,Apparel & Accessories
94,6 ribbons rustic charm,Party & Festive
3,12 daisy pegs in wood box,Home Decor
80,5 hook hanger red magic toadstool,Garden & Outdoor
754,christmas craft tree top angel,Seasonal
753,christmas craft little friends,Seasonal
871,cosy slipper shoes small green,Apparel & Accessories
1239,feltcraft doll rosie,Toys & Games
1236,feltcraft doll emily,Toys & Games
1248,feltcraft princess olivia doll,Toys & Games
2924,rex cash+carry jumbo shopper,Apparel & Accessories
1235,feltcraft cushion rabbit,Stationery & Craft
1233,feltcraft cushion butterfly,Stationery & Craft
3594,tote bag i love london,Apparel & Accessories
1320,folding umbrella pinkwhite polkadot,Apparel & Accessories
1319,folding umbrella cream polkadot,"Health, Beauty & Personal Care"
1322,folding umbrella white/red polkadot,Apparel & Accessories
3048,set 10 lights night owl,Home Decor
1321,folding umbrella red/white polkadot,Apparel & Accessories
3019,s/4 valentine decoupage heart box,Seasonal
3430,soldiers egg cup,Toys & Games
2835,red retrospot mini cases,Kitchen & Dining
98,60 cake cases vintage christmas,Seasonal
2926,ribbon reel christmas sock bauble,Seasonal
2932,ribbon reel snowy village,Party & Festive
3117,set of 20 vintage christmas napkins,Seasonal
3652,turquoise christmas tree,Seasonal
2864,red star card holder,Stationery & Craft
3894,wicker wreath small,Home Decor
125,advent calendar gingham sack,Seasonal
1231,feltcraft butterfly hearts,Stationery & Craft
2441,party cone christmas decoration,Seasonal
3892,wicker star,Home Decor
3762,vintage snap cards,Toys & Games
1229,feltcraft 6 flower friends,Stationery & Craft
319,bird decoration red retrospot,Party & Festive
760,christmas gingham tree,Seasonal
759,christmas gingham star,Seasonal
758,christmas gingham heart,Seasonal
2332,pack of 12 pink polkadot tissues,"Health, Beauty & Personal Care"
1247,feltcraft princess lola doll,Toys & Games
2329,pack of 12 london tissues,"Health, Beauty & Personal Care"
2739,purple drawerknob acrylic edwardian,Home Decor
708,children's apron dolly girl,Toys & Games
712,childrens apron spaceboy design,Toys & Games
766,christmas lights 10 santas,Seasonal
2360,pack of 60 mushroom cake cases,Kitchen & Dining
97,60 cake cases dolly girl design,Toys & Games
1602,hand warmer babushka design,"Health, Beauty & Personal Care"
3059,set 12 retro white chalk sticks,Stationery & Craft
1244,feltcraft hairband red and blue,Apparel & Accessories
1243,feltcraft hairband pink and purple,Apparel & Accessories
1245,feltcraft hairbands pink and white,Apparel & Accessories
3662,tv dinner tray dolly girl,Toys & Games
2671,plasters in tin vintage paisley,"Health, Beauty & Personal Care"
2669,plasters in tin spaceboy,Toys & Games
2672,plasters in tin woodland animals,"Health, Beauty & Personal Care"
2045,magic drawing slate spaceboy,Toys & Games
2042,magic drawing slate go to the fair,Toys & Games
2041,magic drawing slate dolly girl,Toys & Games
677,charlie + lola red hot water bottle,"Health, Beauty & Personal Care"
3674,urban black ribbons,Party & Festive
3202,set of 6 t-lights toadstools,Garden & Outdoor
2978,rotating leaves t-light holder,Home Decor
918,cupcake lace paper set 6,Kitchen & Dining
3605,traditional wooden catch cup game,Toys & Games
3021,s/6 wooden skittles in cotton bag,Toys & Games
2814,red metal beach spade,Garden & Outdoor
534,boys vintage tin seaside bucket,Stationery & Craft
1451,girls vintage tin seaside bucket,Stationery & Craft
1579,grey heart hot water bottle,"Health, Beauty & Personal Care"
1863,kings choice tea caddy,Kitchen & Dining
1860,kings choice biscuit tin,Kitchen & Dining
2091,metal sign empire tea,Kitchen & Dining
1214,fawn blue hot water bottle,"Health, Beauty & Personal Care"
2348,pack of 6 birdy gift tags,Stationery & Craft
668,ceramic strawberry money box,Home Decor
662,ceramic heart fairy cake money bank,Kitchen & Dining
664,ceramic pirate chest money bank,Home Decor
1073,doorstop retrospot heart,Kitchen & Dining
2907,retrospot babushka doorstop,Kitchen & Dining
3532,sweetheart wire wall tidy,Home Decor
2837,red retrospot oven glove,Kitchen & Dining
2215,namaste swagat incense,"Health, Beauty & Personal Care"
667,ceramic strawberry design mug,Kitchen & Dining
822,classical rose small vase,Home Decor
1733,hyacinth bulb t-light candles,Garden & Outdoor
755,christmas craft white fairy,Seasonal
867,cosy hour cigar box matches,Home Decor
2866,red tea towel classic design,"Health, Beauty & Personal Care"
1658,heart filigree dove  small,Home Decor
2911,retrospot childrens apron,Toys & Games
849,colouring pencils brown tube,Apparel & Accessories
67,4 ivory dinner candles silver flock,Home Decor
4021,zinc metal heart decoration,Party & Festive
1540,green fern notebook,Stationery & Craft
456,blue paisley notebook,Stationery & Craft
790,chrysanthemum notebook,Stationery & Craft
1903,large chinese style scissor,Stationery & Craft
3365,small chinese style scissor,Stationery & Craft
1620,hanging glass etched tealight,Kitchen & Dining
859,cooking set retrospot,Kitchen & Dining
1861,kings choice giant tube matches,Home Decor
2665,place setting white star,Home Decor
3008,s/15 silver glass baubles in bag,Kitchen & Dining
1377,french wc sign blue metal,Home Decor
1203,fairy soap soap holder,"Health, Beauty & Personal Care"
1544,green giant garden thermometer,Garden & Outdoor
431,blue giant garden thermometer,Garden & Outdoor
3685,victorian sewing box small,Stationery & Craft
3684,victorian sewing box medium,Stationery & Craft
3222,set/10 red polkadot party candles,Party & Festive
3814,washroom metal sign,"Health, Beauty & Personal Care"
380,black sweetheart bracelet,Apparel & Accessories
984,diamante hair grip pack/2 black dia,Apparel & Accessories
350,black diamante expandable ring,Kitchen & Dining
989,diamante hair grip pack/2 ruby,Apparel & Accessories
987,diamante hair grip pack/2 montana,Apparel & Accessories
493,blue sweetheart bracelet,Apparel & Accessories
2641,pink sweetheart bracelet,Apparel & Accessories
2752,purple sweetheart bracelet,Apparel & Accessories
2925,ribbon reel christmas present,Seasonal
1265,first aid tin,"Health, Beauty & Personal Care"
2057,make your own monsoon card kit,Toys & Games
2328,pack of 12 hearts design tissues,"Health, Beauty & Personal Care"
1659,heart filigree dove large,Home Decor
3534,swirly circular rubbers in bag,Apparel & Accessories
3746,vintage paisley stationery set,Stationery & Craft
3219,set/10 blue polkadot party candles,Party & Festive
2933,ribbon reel socks and mittens,Party & Festive
769,christmas metal tags assorted,Seasonal
788,christmas tree t-light holder,Seasonal
3474,star  t-light holder,Home Decor
1671,heart t-light holder,Home Decor
2115,mini funky design tapes,Stationery & Craft
3479,star wooden christmas decoration,Seasonal
3915,wooden heart christmas scandinavian,Seasonal
777,christmas retrospot tree wood,Seasonal
3274,set/9 christmas t-lights scented,Seasonal
481,blue rose fabric mirror,Home Decor
3575,three canvas luggage tags,Apparel & Accessories
2918,retrospot party bag + sticker set,Party & Festive
2920,retrospot small tube matches,Kitchen & Dining
58,3d christmas stamps stickers,Seasonal
52,36 foil heart cake cases,"Health, Beauty & Personal Care"
2358,pack of 6 sweetie gift boxes,Apparel & Accessories
795,cinammon set of 9 t-lights,Home Decor
2287,orange scented set/9 t-lights,"Health, Beauty & Personal Care"
2934,ribbon reel stripes design,Party & Festive
3112,set of 2 tins jardin de provence,Kitchen & Dining
2058,make your own playtime card kit,Toys & Games
1001,dinosaurs  writing set,Toys & Games
3356,skulls writing set,Stationery & Craft
1046,doormat black flock,Home Decor
756,christmas decoupage candle,Seasonal
2278,office mug warmer polkadot,Kitchen & Dining
