product_id,item,category
2959,romantic images scrap book set,Stationery & Craft
2124,mini jigsaw purdey,Toys & Games
1972,letter shape pencil sharpener,Stationery & Craft
379,black stitched wall clock,Home Decor
1038,door hanger  mum + dads room,Home Decor
2757,queen of the skies holiday purse,Apparel & Accessories
1515,gold scroll glass t-light holder,Kitchen & Dining
1483,glass jar marmalade,Kitchen & Dining
2532,pink butterfly washbag,"Health, Beauty & Personal Care"
3018,s/4 pink flower candles in bowl,Kitchen & Dining
1295,"flower glass garld neckl36""amethyst",Kitchen & Dining
2737,purple boudicca large bracelet,Apparel & Accessories
2791,red boudicca large bracelet,Apparel & Accessories
165,ant copper turq boudicca bracelet,Apparel & Accessories
3650,turq+red boudicca large bracelet,Apparel & Accessories
2527,pink boudicca large bracelet,Apparel & Accessories
284,"bathroom scales, tropical beach","Health, Beauty & Personal Care"
1915,large pink glass sundae dish,Kitchen & Dining
674,charlie & lola wastepaper bin blue,Stationery & Craft
345,black christmas flock droplet,Seasonal
3838,white christmas flock droplet,Seasonal
1306,flowers tile hook,Home Decor
946,danish rose bedside cabinet,Home Decor
584,cake stand victorian filigree large,Kitchen & Dining
2576,pink glass tassle bag charm,Kitchen & Dining
3861,white murano twist bracelet,Apparel & Accessories
1072,doorstop racing car design,Apparel & Accessories
376,black silouette candle plate,Kitchen & Dining
77,4 vanilla botanical candles,Home Decor
1688,hen party cordon barrier tape,Party & Festive
3769,vintage union jack shopping bag,Apparel & Accessories
1367,french kitchen sign blue metal,Toys & Games
1160,empire gift wrap,Stationery & Craft
599,candle plate lace white,Kitchen & Dining
166,ant silver fuschia boudicca ring,Apparel & Accessories
2659,pink/white glass demi choker,Kitchen & Dining
1507,gold m pearl  orbit necklace,Apparel & Accessories
793,chunky silver necklace pastel flowe,Apparel & Accessories
1777,ivory shell heart necklace,Apparel & Accessories
2188,moroccan beaten metal dish large,Kitchen & Dining
4017,zinc heart lattice t-light holder,Home Decor
2941,ridged glass t-light holder,Kitchen & Dining
4015,zinc heart lattice charger large,Home Decor
4016,zinc heart lattice charger small,Home Decor
3289,silver aperitif glass,Kitchen & Dining
177,antique glass place setting,Kitchen & Dining
3186,set of 6 herb tins sketchbook,Garden & Outdoor
3196,set of 6 spice tins pantry design,Kitchen & Dining
3122,set of 3 cake tins pantry design,Kitchen & Dining
2551,pink dog cannister,Apparel & Accessories
2288,orange tv tray table,Kitchen & Dining
499,blue tv tray table,Kitchen & Dining
2736,purple bertie glass bead bag charm,Kitchen & Dining
3527,sweetheart cream steel table rect,"Health, Beauty & Personal Care"
1577,grey acrylic faceted bangle,Apparel & Accessories
2195,mr robot soft toy,Toys & Games
1898,large cake towel chocolate spots,"Health, Beauty & Personal Care"
949,danish rose folding chair,Apparel & Accessories
2596,pink love bird candle,Apparel & Accessories
995,diamante ring assorted in box.,Apparel & Accessories
2785,red   acrylic faceted bangle,Apparel & Accessories
2733,purple acrylic faceted bangle,Apparel & Accessories
3704,vintage blue kitchen cabinet,Toys & Games
3388,small pink glass sundae dish,Kitchen & Dining
1704,home garland painted zinc,Party & Festive
3068,set 3 wicker storage baskets,Home Decor
3321,silver rococo candle stick,Home Decor
2868,red victorian fabric oval box,Home Decor
2266,number tile vintage font 8,Stationery & Craft
2263,number tile vintage font 5,Stationery & Craft
947,danish rose decorative plate,Kitchen & Dining
3781,wake up cockerel tile hook,Home Decor
262,baking mould toffee cup  chocolate,Kitchen & Dining
255,baking mould cupcake chocolate,Kitchen & Dining
3123,set of 3 cake tins sketchbook,Kitchen & Dining
3777,vippassport cover,Apparel & Accessories
3697,vintage bead pink scarf,Apparel & Accessories
3849,white hand towel with butterfly,"Health, Beauty & Personal Care"
3962,wrap circus parade,Stationery & Craft
730,childs garden fork blue,Toys & Games
736,childs garden trowel blue,Toys & Games
1646,happy easter hanging decoration,Seasonal
1621,hanging heart basket,Home Decor
60,3d hearts  honeycomb paper garland,Party & Festive
1639,hanging spring flower egg large,Apparel & Accessories
3872,white stitched wall clock,Home Decor
3149,set of 4 carousel placemats,Kitchen & Dining
238,asstd col butterfly/crystal w/chime,Home Decor
416,blue daisy mobile,Home Decor
203,ass floral print multi screwdriver,DIY & Tools
2268,number tile vintage font no,Stationery & Craft
2267,number tile vintage font 9,Stationery & Craft
2265,number tile vintage font 7,Stationery & Craft
2264,number tile vintage font 6,Stationery & Craft
2262,number tile vintage font 4,Stationery & Craft
2261,number tile vintage font 3,Stationery & Craft
2260,number tile vintage font 2,Stationery & Craft
2259,number tile vintage font 1,Stationery & Craft
2258,number tile vintage font 0,Stationery & Craft
663,ceramic love heart money bank,Home Decor
2480,pens assorted spaceball,Stationery & Craft
2478,pens assorted funky jeweled,Stationery & Craft
3748,vintage pink decorative parasol,Garden & Outdoor
1700,hippy chic decorative parasol,Garden & Outdoor
2196,mrs robot soft toy,Toys & Games
2524,pink bertie glass bead bag charm,Kitchen & Dining
2588,pink hearts light chain,Apparel & Accessories
2810,red hearts light chain,Home Decor
3261,set/6 frog prince t-light candles,Home Decor
3875,"white tea,coffee,sugar jars",Kitchen & Dining
2637,pink stitched wall clock,Apparel & Accessories
1791,jam jar with blue lid,Kitchen & Dining
1475,glass chalice green  small,Kitchen & Dining
477,blue pot plant candle,Kitchen & Dining
1385,frosted white base,Home Decor
2203,multicolour honeycomb paper garland,Party & Festive
2108,milk pan blue polkadot,Kitchen & Dining
912,crystal stud earrings assorted col,Apparel & Accessories
2894,retro brown ball ashtray,Kitchen & Dining
286,beach hut design blackboard,Home Decor
1268,first class passport cover,Apparel & Accessories
3647,turq ice cream bum bag,"Health, Beauty & Personal Care"
3320,silver roccoco chandelier,Home Decor
2571,pink fly swat,Garden & Outdoor
429,blue fly swat,Garden & Outdoor
1919,large red retrospot windmill,Toys & Games
2298,origami rose incense in tube,"Health, Beauty & Personal Care"
2089,metal sign cupcake single hook,Kitchen & Dining
1763,ivory hanging decoration  egg,Party & Festive
3754,vintage red mug,Kitchen & Dining
577,cake plate lovebird pink,Kitchen & Dining
147,amber diamante expandable ring,Kitchen & Dining
1256,fine silver necklace w pastel flowe,Apparel & Accessories
163,ant copper pink boudicca bracelet,Apparel & Accessories
162,ant copper lime boudicca bracelet,Apparel & Accessories
1545,green glass tassle bag charm,Kitchen & Dining
3654,turquoise glass tassle bag charm,Kitchen & Dining
1131,egg cup natural chicken,Kitchen & Dining
3250,set/4 red mini rose candle in bowl,Kitchen & Dining
1225,felt farm animal sheep,Toys & Games
1224,felt farm animal rabbit,Toys & Games
1223,felt farm animal hen,Toys & Games
2539,pink christmas flock droplet,Seasonal
123,"acrylic jewel snowflake,pink",Apparel & Accessories
1798,jardin etched glass fruitbowl,Kitchen & Dining
2939,ridged glass posy vase,Kitchen & Dining
346,black christmas tree 120cm,Seasonal
1378,freshwater pearl bracelet gold,Apparel & Accessories
2388,pale pink/amethyst stone necklace,Apparel & Accessories
1264,fire polished glass neckl gold,Kitchen & Dining
2468,"pearl & shell 42""neckl. green",Apparel & Accessories
3567,teal/fuschia col bead necklace,Kitchen & Dining
149,amber fine bead necklace w tassel,Apparel & Accessories
2563,pink flock glass candleholder,Kitchen & Dining
1800,jardin etched glass small bell jar,Kitchen & Dining
519,botanical rose greeting card,Stationery & Craft
517,botanical lily greeting card,Stationery & Craft
369,black medium glass cake stand,Kitchen & Dining
3505,stripes design monkey doll,Toys & Games
3015,s/4 groovy cat magnets,Home Decor
432,blue gingham rose cushion cover,Home Decor
2508,ping! microwave plate,Kitchen & Dining
2130,mini painted garden decoration,Garden & Outdoor
241,asstd fruit+flowers fridge magnets,Home Decor
2296,origami lavender incense/candl set,"Health, Beauty & Personal Care"
2512,pink  honeycomb paper fan,"Health, Beauty & Personal Care"
814,classic french style basket green,Home Decor
1317,folding umbrella blackblue polkadot,Apparel & Accessories
2302,origami vanilla incense cones,"Health, Beauty & Personal Care"
2303,origami vanilla incense/candle set,"Health, Beauty & Personal Care"
2247,number tile cottage garden 0,Garden & Outdoor
2256,number tile cottage garden 9,Garden & Outdoor
2257,number tile cottage garden no,Garden & Outdoor
2253,number tile cottage garden 6,Garden & Outdoor
2249,number tile cottage garden 2,Garden & Outdoor
2254,number tile cottage garden 7,Garden & Outdoor
2252,number tile cottage garden 5,Garden & Outdoor
2251,number tile cottage garden 4,Garden & Outdoor
2248,number tile cottage garden 1,Garden & Outdoor
2250,number tile cottage garden 3,Garden & Outdoor
842,coffee mug pears  design,Kitchen & Dining
3043,scotties design washbag,"Health, Beauty & Personal Care"
2992,round white confetti in tube,Party & Festive
2509,pink  heart confetti in tube,Party & Festive
581,cake stand lace white,Kitchen & Dining
1995,london bus coffee mug,Kitchen & Dining
2556,pink enamel+glass hair comb,"Health, Beauty & Personal Care"
838,coffee mug apples design,Kitchen & Dining
655,ceramic bowl with love heart design,Kitchen & Dining
518,botanical rose gift wrap,Stationery & Craft
2635,pink spots chocolate nesting boxes,Kitchen & Dining
2759,queens guard coffee mug,Kitchen & Dining
1564,green round compact mirror,Home Decor
3253,set/4 white retro storage cubes,Home Decor
2729,psychedelic tile coaster,Kitchen & Dining
2822,red pudding spoon,Kitchen & Dining
2205,multicolour rabbit egg warmer,Kitchen & Dining
926,curious images scrap book set,Stationery & Craft
2047,magic sheep wool growing from paper,Stationery & Craft
3150,set of 4 diamond napkin rings,Kitchen & Dining
2603,pink new baroque flock candlestick,Apparel & Accessories
3306,silver hoop earrings with flower,Apparel & Accessories
3309,silver lariat black stone earrings,Apparel & Accessories
192,apron modern vintage cotton,Kitchen & Dining
2433,paperweight vintage paisley,Stationery & Craft
2684,polkadot coffee cup & saucer pink,Kitchen & Dining
1113,eau de nil love bird candle,Home Decor
377,black small glass cake stand,Kitchen & Dining
3353,skulls storage box large,Home Decor
2430,paperweight kings choice,Stationery & Craft
1220,felt egg cosy ladybird,Kitchen & Dining
1731,house shape pencil sharpener,Stationery & Craft
3737,vintage kitchen print fruits,Toys & Games
3572,teatime round pencil sharpener,Kitchen & Dining
2170,mobile vintage hearts,Stationery & Craft
1370,french lavender scent heart,"Health, Beauty & Personal Care"
71,4 pink dinner candle silver flock,Apparel & Accessories
2300,origami sandlewood incense+flower,"Health, Beauty & Personal Care"
1176,enamel pink tea container,Kitchen & Dining
1175,enamel pink coffee container,Kitchen & Dining
3640,tropical passport cover,Apparel & Accessories
3513,sunflower decorative parasol,Garden & Outdoor
2570,pink fluffy christmas decoration,Seasonal
2178,money box housekeeping design,Apparel & Accessories
1762,ivory hanging decoration  bird,Party & Festive
3297,silver disco handbag,Apparel & Accessories
3324,silver t-light setting,Home Decor
395,blossom images scrap book set,Stationery & Craft
2908,retrospot candle  large,Kitchen & Dining
962,decoration white chick magic garden,Garden & Outdoor
2176,money box first ade design,Home Decor
2574,pink gingham cat with scarf,Apparel & Accessories
1282,floral soft car toy,Toys & Games
2538,pink chick egg warmer + egg cup,Kitchen & Dining
397,blue  tile hook,Home Decor
2561,pink felt easter rabbit garland,Seasonal
3039,school desk and chair,Apparel & Accessories
3831,white baroque wall clock,Home Decor
340,black baroque wall clock,Home Decor
3232,set/3 polkadot stacking tins,Toys & Games
3554,tea cosy red  stripe,Kitchen & Dining
3939,woodland storage box large,Home Decor
582,cake stand lovebird 2 tier pink,Kitchen & Dining
2688,polyester filler pad 30cmx30cm,Home Decor
2171,mock lobster fridge magnet,Home Decor
3910,wooden box advent calendar,Seasonal
1093,drop diamante earrings purple,Apparel & Accessories
164,ant copper red boudicca bracelet,Apparel & Accessories
1090,drop diamante earrings black diamon,Apparel & Accessories
3758,vintage rose bead bracelet raspberr,Apparel & Accessories
1941,lazer cut necklace w pastel beads,Apparel & Accessories
81,5 strand glass necklace amber,Kitchen & Dining
3331,silver/mop orbit necklace,Apparel & Accessories
941,daisy hair band,Apparel & Accessories
2738,purple chunky glass+bead necklace,Kitchen & Dining
3511,summer daisies bag charm,Apparel & Accessories
813,classic french style basket brown,Home Decor
1115,eau de nile jewelled photoframe,Home Decor
2528,pink boudoir t-light holder,Apparel & Accessories
886,cream delphinium artificial flower,"Health, Beauty & Personal Care"
1926,large white/pink rose art flower,Apparel & Accessories
2080,medium white/pink rose art flower,Apparel & Accessories
3829,white anemone artificial flower,Home Decor
2533,pink candystuft artificial flower,Apparel & Accessories
2522,pink baby bunting,Party & Festive
959,"decoration , wobbly rabbit , metal",Party & Festive
1382,frog candle,Home Decor
3976,wrap monster fun,Toys & Games
3599,toybox  wrap,Toys & Games
402,blue blossom hair clip,Apparel & Accessories
2639,pink strawberry handbag,Apparel & Accessories
2162,mirrored wall art table lamp,Home Decor
3403,small skull windmill,Toys & Games
3234,set/3 rabbits flower skippping rope,Apparel & Accessories
294,beaded crystal heart green large,Home Decor
1576,"greeting card,square, doughnuts",Stationery & Craft
997,dinosaur height chart sticker set,Toys & Games
1725,hot water bottle babushka large,"Health, Beauty & Personal Care"
326,birthday banner tape,Party & Festive
2122,mini jigsaw go to the fair,Toys & Games
3852,white heart confetti in tube,Party & Festive
1463,glass bead hoop earrings black,Kitchen & Dining
1462,glass bead hoop earrings amethyst,Kitchen & Dining
3312,silver m.o.p orbit bracelet,Apparel & Accessories
2211,murano style glass bracelet red,Kitchen & Dining
1554,green murano twist bracelet,Apparel & Accessories
2209,murano style glass bracelet black,Kitchen & Dining
612,cannabis leaf bead curtain,Home Decor
2283,opium scented votive candle,"Health, Beauty & Personal Care"
1950,"letter ""d"" bling key ring",Apparel & Accessories
2003,love heart trinket pot,Kitchen & Dining
2623,pink pot plant candle,Kitchen & Dining
1499,glow in dark dolphins,Toys & Games
1938,lavender scent cake candle,"Health, Beauty & Personal Care"
1352,french blue metal door sign 7,Home Decor
3992,yellow dragonfly helicopter,Toys & Games
703,chest natural wood 20 drawers,Home Decor
3822,wheelbarrow for children,Toys & Games
733,childs garden rake pink,Toys & Games
265,baking set 9 piece retrospot,Kitchen & Dining
2613,pink paper parasol,Garden & Outdoor
4,12 egg house painted wood,Kitchen & Dining
2599,pink metal chicken heart,Apparel & Accessories
1530,green cat floral cushion cover,Home Decor
1119,edwardian drop earrings jet black,Apparel & Accessories
2745,purple frangipani hairclip,Kitchen & Dining
360,black flower candle plate,Kitchen & Dining
423,blue egg  spoon,Kitchen & Dining
3755,vintage red teatime mug,Kitchen & Dining
2697,popart wooden pencils asst,Stationery & Craft
2819,red polkadot beaker,Kitchen & Dining
3138,set of 36 dinosaur paper doilies,Toys & Games
3556,tea party  wrapping paper,Party & Festive
3863,white rosebud  pearl earrings,Apparel & Accessories
2823,red purse with pink heart,Apparel & Accessories
409,blue chenille shaggy cushion cover,Home Decor
2535,pink cat floral cushion cover,Apparel & Accessories
3729,vintage glass tea caddy,Kitchen & Dining
2889,relax large wood letters,Home Decor
1305,flowers tile coaster,Kitchen & Dining
1797,jardin etched glass cheese dish,Kitchen & Dining
1616,hanging chick green decoration,Party & Festive
1627,hanging hen on nest decoration,Party & Festive
1101,easter craft 4 chicks,Seasonal
3300,silver fishing gnome,Garden & Outdoor
532,box/12 chick & egg in basket,Home Decor
1640,hanging spring flower egg small,Apparel & Accessories
2127,mini ladle love heart red,Kitchen & Dining
636,card wedding day,Stationery & Craft
2652,pink/flower rabbit egg warmer,Kitchen & Dining
106,75 green fairy cake cases,Kitchen & Dining
3098,set of 16 vintage black cutlery,Kitchen & Dining
1183,english rose metal waste bin,Home Decor
3964,wrap daisy carpet,Stationery & Craft
3233,set/3 pot plant candles,Kitchen & Dining
3987,wrap wedding day,Stationery & Craft
1633,hanging metal rabbit decoration,Party & Festive
1409,fuschia retro bar stool,Garden & Outdoor
855,condiment tray 4 bowls and 4 spoons,Kitchen & Dining
605,candy spot bunny,Kitchen & Dining
2632,pink scottie dog w flower pattern,Apparel & Accessories
486,blue scottie dog w flower pattern,Apparel & Accessories
2761,rabbit easter decoration,Seasonal
2201,multicolour easter rabbit,Seasonal
1699,hilda candy spot rabbit,Kitchen & Dining
173,antique cream cutlery shelf,"Health, Beauty & Personal Care"
3770,vintage wooden bar stool,Garden & Outdoor
3999,yellow pot plant candle,Kitchen & Dining
939,daisy folkart heart decoration,Party & Festive
2381,painted yellow wooden daisy,Home Decor
938,daisies  honeycomb garland,Party & Festive
856,congratulations bunting,Party & Festive
2730,psychedelic tile hook,Home Decor
3738,vintage kitchen print puddings,Toys & Games
1748,icon placemat pop art elvis,Kitchen & Dining
586,cake stand victorian filigree small,Kitchen & Dining
3989,"wrap, carousel",Stationery & Craft
1473,glass chalice blue small,Kitchen & Dining
1114,eau de nile heart shape photo frame,Home Decor
398,blue  voile lampshade,"Health, Beauty & Personal Care"
2969,rose du sud drawstring bag,Apparel & Accessories
3258,set/6 collage paper cups,Kitchen & Dining
3263,set/6 fruit salad paper cups,Kitchen & Dining
3262,set/6 fruit salad  paper plates,Kitchen & Dining
607,candy spot egg warmer hare,Kitchen & Dining
608,candy spot egg warmer rabbit,Kitchen & Dining
1574,"greeting card, sticky gordon",Party & Festive
1573,"greeting card, overcrowded pool.",Stationery & Craft
956,decoration  butterfly  magic garden,Garden & Outdoor
957,decoration  pink chick magic garden,Garden & Outdoor
559,bunny decoration magic garden,Garden & Outdoor
1575,"greeting card, two sisters.",Stationery & Craft
3172,set of 4 polkadot coasters,Kitchen & Dining
804,citrus garland felt flowers,Party & Festive
3242,set/4 badges dogs,Apparel & Accessories
3240,set/4 badges beetles,Apparel & Accessories
1104,easter decoration hanging bunny,Seasonal
1106,easter decoration sitting bunny,Seasonal
1103,easter decoration egg bunny,Seasonal
2968,rose du sud cushion cover,Home Decor
1977,lighthouse printed metal sign,Home Decor
3655,turquoise heart of glass bracelet,Kitchen & Dining
1549,green heart of glass bracelet,Kitchen & Dining
2545,pink crystal+glass bracelet,Kitchen & Dining
348,black chunky bead bracelet w strap,Apparel & Accessories
3653,turquoise crystal+glass bracelet,Kitchen & Dining
2890,resin bracelet w pastel beads,Apparel & Accessories
2891,resin necklace w pastel beads,Apparel & Accessories
1904,large circular mirror mobile,Home Decor
2232,new baroque jewellery box,Apparel & Accessories
2230,new baroque black boxes,Home Decor
2189,moroccan beaten metal mirror,Home Decor
414,blue crusoe check lampshade,Administrative
3740,vintage kitchen print vegetables,Toys & Games
1641,hanging wood and felt butterfly,Home Decor
1642,hanging wood and felt flower,Home Decor
3093,set of 12 mini bunnies in a bucket,Toys & Games
2240,ninja rabbit black,Home Decor
966,decorative flore bathroom bottle,"Health, Beauty & Personal Care"
393,blossom  images notebook set,Stationery & Craft
2585,pink heart red handbag,Apparel & Accessories
1991,little pink monster soft toy,Toys & Games
3565,tea time tea towels,"Health, Beauty & Personal Care"
2462,pastel colour honeycomb fan,"Health, Beauty & Personal Care"
2537,pink cherry lights,Apparel & Accessories
1638,hanging ridge glass t-light holder,Kitchen & Dining
848,colourful flower fruit bowl,Kitchen & Dining
1112,easter tree yellow birds,Seasonal
1266,first class holiday purse,Apparel & Accessories
1472,glass cake cover and plate,Kitchen & Dining
318,bird decoration green polkadot,Party & Festive
2620,pink polkadot kids bag,Toys & Games
2149,mirror mosaic t-light holder round,Home Decor
3965,wrap doiley design,"Health, Beauty & Personal Care"
2625,pink retro big flower bag,Apparel & Accessories
2126,mini ladle love heart pink,Kitchen & Dining
3888,white/pink chick decoration,Party & Festive
3953,wrap alphabet design,Stationery & Craft
2560,pink felt easter egg basket,Seasonal
1326,folk felt hanging multicol garland,Party & Festive
1613,hanging butterfly  egg,Home Decor
2579,pink hanging gingham easter hen,Seasonal
436,blue hanging gingham easter hen,Seasonal
958,"decoration , wobbly chicken, metal",Party & Festive
561,bunny egg garland,Party & Festive
392,blond doll doorstop,Toys & Games
389,black/white glass/silver bracelet,Kitchen & Dining
3993,yellow easter egg hunt start post,Seasonal
1535,green easter egg hunt start post,Seasonal
1097,easter bunny garland of flowers,Seasonal
606,candy spot cushion cover,Kitchen & Dining
193,aqua bertie glass bead bag charm,Kitchen & Dining
3066,set 3 song bird paper eggs assorted,Stationery & Craft
3064,set 3 paper vintage chick paper egg,Stationery & Craft
2474,peg bag apple design,Apparel & Accessories
1398,frying pan red polkadot,Kitchen & Dining
3255,set/5 red spotty lid glass bowls,Kitchen & Dining
2019,lunch bag red spotty,Kitchen & Dining
2155,mirrored wall art ladies,Home Decor
298,beaded crystal heart pink on stick,Apparel & Accessories
292,beaded crystal heart blue on stick,Home Decor
295,beaded crystal heart green on stick,Home Decor
243,asstd rasta key-chains,Apparel & Accessories
3979,wrap poppies  design,Stationery & Craft
1098,easter bunny hanging garland,Seasonal
560,bunny egg box,Home Decor
1099,easter bunny with basket on back,Seasonal
422,blue easter egg hunt start post,Seasonal
38,3 pink hen+chicks in basket,Apparel & Accessories
15,12 pink hen+chicks in basket,Apparel & Accessories
1100,easter bunny wreath,Seasonal
1383,frog king watering can,Garden & Outdoor
2504,pin cushion babushka blue,Apparel & Accessories
87,50cm metal string with  7 clips,Apparel & Accessories
228,assorted shapes photo clip silver,Home Decor
3986,wrap vintage petals  design,Stationery & Craft
2531,pink butterfly cushion cover,Apparel & Accessories
3837,white candystuft artificial flower,Home Decor
24,2 picture book eggs easter bunny,Seasonal
2600,pink metal swinging bunny,Apparel & Accessories
221,assorted farmyard animals in bucket,Toys & Games
2816,red paper parasol,Garden & Outdoor
2111,mini  zinc garden decorations,Garden & Outdoor
2074,medium ceramic top storage jar,Kitchen & Dining
4014,zinc heart lattice 2 wall planter,Garden & Outdoor
1272,flag of st george,Party & Festive
500,blue victorian fabric oval box,Home Decor
484,blue savannah picnic hamper for 2,Garden & Outdoor
1686,hen house w family in barn & nest,Home Decor
2873,red/cream stripe cushion cover,"Health, Beauty & Personal Care"
2536,pink cherry blossom cup & saucer,Kitchen & Dining
990,"diamante heart shaped wall mirror,",Home Decor
1963,"letter ""r"" bling key ring",Apparel & Accessories
1340,four rabbit easter decorations,Seasonal
3154,set of 4 green carousel coasters,Kitchen & Dining
3399,small round cut glass candlestick,Kitchen & Dining
2592,pink hydrangea art flower,Apparel & Accessories
901,crochet rose purse with suede back,Apparel & Accessories
1876,la palmiera tile hook,Home Decor
3409,small white/pink rose art flower,Apparel & Accessories
2310,oyster trinket box,Home Decor
291,beaded crystal heart blue  large,Home Decor
1541,green fern pocket book,Stationery & Craft
2157,mirrored wall art poppies,Home Decor
3269,set/6 posies paper plates,Kitchen & Dining
1270,five cats hanging decoration,Party & Festive
2794,red daisy paper lampshade,Stationery & Craft
2502,pig mug in two colour designs,Kitchen & Dining
1275,flames sunglasses pink lenses,Kitchen & Dining
2616,pink pillar candle silver flock,Apparel & Accessories
3473,standing fairy pole support,Home Decor
26,2 picture book eggs easter ducks,Seasonal
2994,ruby drop chandelier earrings,Apparel & Accessories
3724,vintage enamel & crystal earrings,Apparel & Accessories
850,columbian  cube candle,Home Decor
25,2 picture book eggs easter chicks,Seasonal
1486,glass sphere candle stand medium,Kitchen & Dining
3698,vintage bead pink shade,Apparel & Accessories
1953,"letter ""g"" bling key ring",Apparel & Accessories
3515,sunset colour chunky knitted throw,Home Decor
1894,large blue provencal ceramic ball,Kitchen & Dining
2776,rectangular shaped mirror,Home Decor
967,decorative hanging shelving unit,Home Decor
363,black glass bracelet w heart charms,Kitchen & Dining
3651,turquoise bertie glass bead charm,Kitchen & Dining
3889,white/pink chick easter decoration,Seasonal
1643,hanging wood and felt heart,Home Decor
1102,easter craft ivy wreath with chick,Seasonal
3832,white beaded garland string 20light,Party & Festive
3483,steel sweetheart round table cream,"Health, Beauty & Personal Care"
3571,teatime push down rubber,Kitchen & Dining
49,3 wick christmas briar candle,Seasonal
3010,s/2 zinc heart design planters,Garden & Outdoor
920,cupid scented candle in glass,"Health, Beauty & Personal Care"
2046,magic garden felt garland,Garden & Outdoor
3853,white heart of glass bracelet,Kitchen & Dining
